225,5212,Technical occupations related to museums and art galleries,aircraft restoration technician - museum ,aquarium interpreter ,archaeological technician ,"aircraft restoration technician - museumaquarium interpreterarchaeological technicianart gallery preparatorart gallery registrarart objects preparatorart restoration technicianassistant registrar - museumbotanical garden interpretercataloguer - museumcataloguer, museum objectschief display officer - museumchief exhibit officer - museumchief preparatorchief preparator - museums and art galleriescommunications equipment restoration technician - museumcommunity museum technicianconservation and restoration technicianconservation area interpreterconservation technician - museums and art galleriescuratorial assistantdinosaur museum interpreterdiorama maker - museums and art galleriesdiorama techniciandisplay officer - museums and art galleriesdocument restoration technicianecological interpreterexhibit officer - museumexhibit preparatorexhibit technicianfossil recovery and reparation technicianframe fitter - museums and art galleriesframer - museum and art galleryframing technicianhead preparator - museums and art galleriesheritage interpreterhistorical interpreterhistorical site technicianhistorical village supervisorhistorical village technicianhistoric site interpreterhistory museum interpreterinsectarium interpreterinterpreter, historic siteinterpreter, museuminterpretive guide - museummodel maker-preparatormuseology technicianmuseum cataloguermuseum exhibit officermuseum extension officermuseum interpretermuseum objects cataloguermuseum objects preparatormuseum preparatormuseum registrarmuseum technicianmuseum technician - earth's history and paleontologynatural habitat interpreternature interpreternature site interpreterornithology centre interpreterpaintings restoration technicianpark interpreterpicture framer - museum and art galleryplanetarium interpreterplanetarium technicianpreparatorrailway equipment restoration technician - museumrecording technician - museumregional museum technicianregistrar, museumrestoration technician - museumroad transport equipment restoration technician - museumtaxidermisttaxidermy techniciantechnical officer - museumtechnician, conservation - museums and art galleriestechnician, museumtechnician, restoration - museumwilderness interpreterzoo interpreter",305,2,4,0.59,261,"Occupations in art, culture, recreation and sport",2,"Technical occupations in art, culture, recreation and sport",20,52,61,32,116,Writing,Reading,Document Use,3,19,20,3,17,4,3,12,19,49,8,24,25,55,0,30,0,125,20,60,0,70,0,0,0,0,0,0,10,20,0,125,20,60,0,70,0,0,0,0,0,0,0,0,0,0,0
226,5221,"Aircraft instrument, electrical and avionics mechanics, technicians and inspectors                                   ",aerial photographer ,chief photographer ,commercial photographer ,"aerial photographerchief photographercommercial photographerevidence photographer - forensicfashion photographerfinish photographerforensic photographerindustrial photographermedical photographermultimedia photographermultimedia picture illustratornews photographerphotographerphotography supervisorphotojournalistphotomicrographerpolice photographerportrait photographerracetrack finish photographerretoucher - photographyscientific photographerstill photographerstreet photographersupervisor, photographywildlife photographer",3570,1,2.346335698,0.3255,161.5,Natural and applied sciences and related occupations,6,Technical occupations related to natural and applied sciences,32.2,45,43.5,22.5,50,Digital Technology,Document Use,Reading,5.5,10.5,5.5,2.5,10,3,3.5,13.5,10.5,19,6,20.5,19.5,18,14,0,25,0,110,1825,0,100,40,0,0,0,85,0,0,0,0,0,110,1825,0,100,40,25,0,0,0,0,0,0,0,85,0
227,5222,Film and video camera operators,assistant camera operator ,camera operator ,"camera operator, motion picture ","assistant camera operatorcamera operatorcamera operator, motion picturecamera operator, videodance videographerEFP (electronic field production) camera operatorelectronic field production (EFP) camera operatorelectronic news gathering (ENG) camera operatorENG (electronic news gathering) camera operatorfilm cameramanfilm cameraman/womanfilm camera operatorfilm camerawomanmotion picture camera operatornews camera operatorsenior motion picture camera operatorstudio camera operatortelevision camera operatortelevision news camera operatorvideo camera operatorvideographer",480,0,2.4,0.6,137,"Occupations in art, culture, recreation and sport",2,"Technical occupations in art, culture, recreation and sport",30,37,35,20,46,Reading,Document Use,Digital Technology,5,9,6,3,7,3,4,14,9,19,5,15,17,12,7,0,0,0,70,410,0,0,0,0,0,0,0,0,0,0,0,0,70,410,0,0,0,0,0,0,0,0,0,0,0,0,0
228,5223,Graphic arts technicians,airbrush artist ,animated cartoon inker ,animated cartoon painter ,"airbrush artistanimated cartoon inkeranimated cartoon painteranimated cartoons inker and painteranimated cartoon techniciananimation camera operatoranimation inkeranimation painterapprentice sign painterartist, airbrushartist, cartoon backgroundartist, paste-upart work assemblerassembler, art workassembler, graphic artscartoon background artistcolourist, photographycomputer graphics design techniciancomputer graphics operatorcomputer graphics techniciancopy stylist, graphic artscutter, silkscreen stencilsdesign assistant - advertising productiondesigner, poster layoutsdetailer, sign layoutsdigital graphic design techniciangraphic arts assemblergraphic arts copy stylistgraphic arts renderergraphic arts techniciangraphics technicianhand painter - graphic artsinker and painter, animated cartoonsinker, animated cartoonsletterer, photo processes - graphic artslettering artistmannequin artistmultimedia graphic design technicianmultimedia graphics technicianoperator, animation camerapainter, animated cartoonspainter, animationpainter, hand - graphic artspainter, posterspainter, signspainter, traffic signspaste-up artistphotographic airbrush artistphotographic colouristphotograph retoucherphotography colouristphoto process letterer - graphic artsphoto stencil makerposter layout designerposter painterrenderer, graphic artsrendering specialistscreen stencil cutter - graphic artssign layout detailersign paintersign writersilkscreen stencil cuttersilkscreen technicianstencil markerstencil marker - graphic artstechnician, graphic artstechnician, silkscreentraffic sign paintervideo game artistvideo game designervinyl lettering artistwriter, signs",345,2,2,0.049,151,"Occupations in art, culture, recreation and sport",2,"Technical occupations in art, culture, recreation and sport",19,34,31,26,60,Writing,Reading,Oral Communication,3,10,10,3,12,3,3,18,8,20,8,17,14,22,0,0,0,0,0,345,0,0,0,0,0,0,0,0,0,0,0,0,0,345,0,0,0,0,0,0,0,0,0,0,0,0,0
229,5225,Audio and video recording technicians,assistant sound editor ,audio engineer - recording studio ,audio operator ,"assistant sound editoraudio engineer - recording studioaudio operatoraudio operator assistantaudio recording studio operatoraudio technicianaudiovisual (AV) technicianAV (audiovisual) techniciancolour timer - videodigital effects specialistdubbing machine operatoreditor, soundeditor, videotapeelectronic news gathering (ENG) editorelectronic video graphics operatorENG (electronic news gathering) editorfilm technicianfilm technician - motion picturemaster record cuttermixer, music or soundmultimedia sound-effects supervisormultimedia sound technicianmusic editor - recording studiomusic mixermusic or sound mixeroperator, P.A. (public address)operator, P.A. (public address) systemsoperator, public address (P.A.)operator, public address (P.A.) systemsP.A. (public address) operatorP.A. (public address) system operatorplayback operatorpostproduction technicianproduction sound recordistpublic address (P.A.) operatorpublic address (P.A.) system operatorradio recorderradio technicianrecording engineerrecording studio technicianre-recording mixersound cuttersound editorsound effects editorsound effects specialistsound engineersound engineer assistantsound engineer (except professional engineers)sound keyersound librarian - audio-recordingsound mix engineersound mixersound operatorsound recordersound-recording and video-recording reproduction equipment operatorsound recording engineersound-recording equipment operatorsound recording supervisorsound recordistsound technicianstereo tape editorstudio operator, audio recordingsupervisor, sound recordingvideo and sound recordervideo-editing equipment operatorvideo recordervideo-recording equipment operatorvideo recording technicianvideo sound mixervideotape editorvideotape postproduction editorvideotape recording (VTR) editorvideotape recording (VTR) operatorvideotape technicianvideo technicianVTR (videotape recording) editorVTR (videotape recording) operator",2075,0,2.647058824,0.55,138,"Occupations in art, culture, recreation and sport",2,"Technical occupations in art, culture, recreation and sport",26.19,37,35,20,46,Reading,Document Use,Oral Communication,5,9,6,3,7,3,4,15,9,19,5,15,17,13,7,10,30,0,105,1890,20,0,0,0,0,0,20,0,0,0,0,0,105,1890,20,0,0,30,0,0,0,0,10,0,0,20,0
230,5226,"Other technical and co-ordinating occupations in motion pictures, broadcasting and the performing arts               ","animal wrangler - motion pictures, broadcasting and performing arts ",broadcasting co-ordinator ,chief lighting technician ,"animal wrangler - motion pictures, broadcasting and performing artsbroadcasting co-ordinatorchief lighting technicianchief stage electricianchief technician, lighting effectscostume makercostumercostumer - motion pictures, broadcasting and performing artscostumes co-ordinatorcostume supervisorcostumierelectrician, setelectrician, stageexterior set managerexterior shooting directorextra wrangler - motion pictures, broadcasting and performing artsfilm location managerfirst gripfloor director - broadcastingfloor manager - broadcastinggafferhead griphead of wardrobekey dresserkey griplighting effects chief technicianlighting technicianlocation manager - motion pictures and broadcastingmachinist-electricianmake-up artistmake-up artist and hairdresser - performing artsmake-up artist and wig makermake-up artist - motion pictures, broadcasting and performing artsmotion picture facilities supervisormusic program plannermusic program planner, radiooptical effects co-ordinatorpresentation co-ordinator - broadcastingproduction co-ordinator - motion pictures, broadcasting and performing artsproduction co-ordinator - radiobroadcastingproduction technician - motion pictures, broadcasting and performing artsprogram co-ordinator - broadcastingprogramming managerprogram planner, musicprogram planner, radioproperties custodian - stage productions or motion picturesproperty master - broadcastingproperty master - motion pictures, broadcasting and performing artsradio music program plannerradio program plannerremote broadcasting co-ordinatorrigging gafferscript supervisorset electriciansettings shop foremansettings shop foreman/womansettings shop forewomanspecial effects techniciansports program co-ordinator - broadcastingstage assistant directorstage electricianstage managerstage technicianstaging supervisorstudio administratorstudio electricianstudio managerstudio manager - broadcastingstunt co-ordinatortelecasting techniciantheatre technicianunit manager - motion pictures and broadcastingwardrobe co-ordinatorwardrobe masterwardrobe master/mistresswardrobe mistresswardrobe supervisorwig hairdresser - motion pictures, broadcasting and performing arts",725,0,2.826086957,0.61,135,"Occupations in art, culture, recreation and sport",2,"Technical occupations in art, culture, recreation and sport",25,37,34,19,45,Reading,Document Use,Digital Technology,5,9,6,3,7,3,4,14,9,19,5,15,17,12,6,0,0,0,20,660,0,45,0,0,0,0,0,0,0,0,0,0,20,660,0,45,0,0,0,0,0,0,0,0,0,0,0
231,5227,"Support occupations in motion pictures, broadcasting, photography and the performing arts                            ",artistic rigger ,audiovisual (AV) assistant - motion pictures and broadcasting ,AV (audiovisual) assistant ,"artistic riggeraudiovisual (AV) assistant - motion pictures and broadcastingAV (audiovisual) assistantbest boyboom gripboom microphone operatorboom operatorcamera crane operatorcircus riggercontinuity person - motion pictures and broadcastingdolly operator - motion pictures and broadcastingdolly pusher - motion pictures and broadcastingdresserdresser - motion pictures, broadcasting and performing artsduplicate-film examiner - motion pictures and broadcastingentertainment stage riggerexaminer, duplicate film - motion pictures and broadcastingexaminer, motion picturesfilm projectionistfilm quality inspectorfireworks handlerflymanflyman/womanflywomanfocus pullergriphandler, fireworkshigh rigger, theatreinspector, film qualitylighting assistantmotion picture examinermotion picture projectionistmovie theatre projectionistoperator, boom microphoneproduction assistantproduction assistant - motion pictures and broadcastingprojectionistprojectionist, motion picturesprompterproperty personprops handlerprops personrecording assistant - recording studiorigger - motion pictures, broadcasting and performing artsscene shifterscenic artist - motion pictures, broadcasting and performing artsscenic constructorscenic constructor - motion pictures, broadcasting and performing artsscenic painter - motion pictures, broadcasting and performing artsscript assistantscript person - motion pictures and broadcastingsearchlight operatorsecond costumes assistantset builderset dresserspecial effects assistantspotlight operatorstage best boystagehandstage production workerstage property personstaging assistanttechnical assistant - audiovisualtelecine operatorteleprompt operatortheatre high riggerwardrobe assistantwardrobe attendantwig assistant - motion pictures, broadcasting and performing arts",610,0,3.095238095,0.674,131,"Occupations in art, culture, recreation and sport",2,"Technical occupations in art, culture, recreation and sport",23,36,33,19,43,Reading,Document Use,Oral Communication,4,9,6,3,7,3,4,14,9,18,5,14,17,11,6,0,0,0,55,505,0,50,0,0,0,0,0,0,0,0,0,0,55,505,0,50,0,0,0,0,0,0,0,0,0,0,0
232,5232,"Other performers, n.e.c.                                                                                             ",acrobat ,aerial acrobat - entertainment ,art and photography model ,acrobataerial acrobat - entertainmentart and photography modelbuskercircus artistcircus performerclowncontortionistdeejay (DJ) - turntablistDJ (deejay) - turntablistentertainerequilibristerotic dancerexotic dancerface painterfashion modelhigh-wire walkerhypnotistillusionistimpersonatorjugglerlook-alikemagicianmarionette handlermascotmimicmodelMrs. Clausnude dancerprestidigitatorpuppeteerrodeo driverrodeo horse riderSanta ClausSanta Claus/Mrs. Clausshow horse riderslack-rope performer - entertainmentsleight-of-hand artiststreet entertainerstriptease dancerstuntmanstuntman/womanstunt performerstunt riderstuntwomantable dancerthrill performertrapeze artistturntablistveejay (VJ) - video performance artistventriloquistVJ (veejay) - video performance artist,35,0,4,0.371,146,"Occupations in art, culture, recreation and sport",2,"Technical occupations in art, culture, recreation and sport",30.07604967,39,37,21,49,Reading,Digital Technology,Digital Technology,6,10,7,3,7,3,4,15,10,20,6,17,17,14,8,0,0,0,0,0,0,15,0,0,0,0,20,0,0,0,0,0,0,0,0,15,0,0,0,0,0,0,0,0,0,20,0
233,5241,Graphic designers and illustrators,2D animation artist ,2D animator ,3D animation artist ,"2D animation artist2D animator3D animation artist3D animatoradvertising art directoradvertising artistadvertising art supervisoradvertising designeradvertising illustratoradvertising layout designeranimated cartoon artistanimated cartoon artist - visual artsanimated cartoon colouristanimation artistanimation layout designeranimator - animated filmsanimator, graphic design and illustrationartistic illustratorartist, storyboardart layout designerassistant animator - animated filmsbackground artistbank note designerbiological illustratorbusiness forms designercalligraphercalligraphic artistcaricaturistcartoon film artistcartoonistcartoonist sketchcatalogue illustratorcell animatorcharacter animatorchief, advertising illustratorcolour artist - cartoonscolourist - cartoonscommercial artistcommercial design artistcommercial designercommunication designercomputer animatorcomputer graphics specialistcontent directorcontent strategistcover designercover page illustratorcybergraphic designerdesigner, form layoutsdigital animator - artisteditorial cartoonistelectronic games designerfashion illustratorflash designerform layout designerforms designergraphic artistgraphic arts room supervisorgraphic design and illustration animatorgraphic designergraphic designer and layout artistgraphic designer - multimediagraphic designer - multimedia, interactive or new mediagraphic designer, Webillustratorillustrator and graphic designerinteractive media designerInternet graphic designerlayout artistlayout designerlayout designer, animationlitho artistmedical illustratormultimedia designermultimedia design specialistmultimedia illustratormultimedia instructional designer and scriptormultimedia products designermultimedia products designer-ideamanmultimedia products designer-ideaman/womanmultimedia products designer-ideawomannew media graphics designernewspaper illustratorpackage designerpage designerpaper securities designerpictographistpolitical caricaturistpolitical cartoonistposter artistregistered graphic designer (RGD)RGD (registered graphic designer)scientific illustratorsign designersports cartooniststoryboard artistsupervisor, advertising artsupervisor, graphic arts roomtitle artistuser experience designer",18510,0,3.108108108,0.082,159,"Occupations in art, culture, recreation and sport",2,"Technical occupations in art, culture, recreation and sport",26.92,43,40,22,54,Reading,Digital Technology,Oral Communication,7,10,7,3,7,4,4,17,10,21,7,19,17,16,9,40,370,55,1010,15025,650,510,50,65,0,30,705,0,15,0,120,55,1010,15025,650,510,50,250,65,0,0,0,25,0,30,705,0
234,5242,Interior designers and interior decorators,aircraft interior designer ,building space planner ,business aircraft interior designer ,"aircraft interior designerbuilding space plannerbusiness aircraft interior designercertified interior designercolour consultant - home decoratingdecorating consultantdesigner - interior designgreen design consultant - interior designhome decorating consultanthome decoratorhome organizerhome stagerhome staging consultantinterior decorating consultantinterior decoratorinterior design consultantinterior designerinterior designer assistantinterior design project managerinterior design technicianinterior space designerkitchen designerlicensed interior designeroffice space plannerproject manager, interior designregistered interior designerretail space plannerspace management consultant",5785,0,3.154929577,0.022,160,"Occupations in art, culture, recreation and sport",2,"Technical occupations in art, culture, recreation and sport",24.62,43,40,22,55,Reading,Digital Technology,Oral Communication,7,10,7,3,7,4,4,17,10,21,7,20,17,16,9,0,475,270,80,4320,0,275,60,0,0,35,270,0,0,0,455,270,80,4320,0,275,60,20,0,0,0,0,0,0,35,270,0
235,5243,"Theatre, fashion, exhibit and other creative designers                                                               ",assistant costume designer ,clothing designer ,costume designer ,"assistant costume designerclothing designercostume designercostume designer - exhibits and theatrecouturier - haute couturecrest designerdesigner, clothingdesigner, displaysdesigner, exhibitsdesigner, museumdesigner, textiledesigner - theatredisplay designerdisplay designer - museums and art galleriesdisplay designers supervisordisplay design supervisorembroidery designerexhibit and display designerexhibit designerexhibit designer - museums and art galleriesexhibit designers supervisorexhibition designer - museums and art galleriesfabric designerfacilities designerfashion co-ordinatorfashion designerfashion goods co-ordinatorfashion goods exhibit co-ordinatorfashion stylistfashion wear designerfishing lure designerflower designerfood stylistfur designergarment designerglove designerhandbag designerhat designerheraldistjacket designerjewellery designerlighting designerlighting designer - exhibitsluggage designerluggage stylistmemorial designermuseum designermuseum exhibit designernovelties stylistpottery designerrug designerscene designerscene designer assistantset decorator - theatre and motion picturesset designer - theatreshoe designershow and demonstration designersound designerstage scenery designerstore display designersupervisor, display designswimming pool designertextile designertheatre designertile designertoy designer - arts and craftstrophy designervisual display stylistvisual merchandiserwindow display designerwomen's fashion designer",1890,0,2.909090909,0.013,160,"Occupations in art, culture, recreation and sport",2,"Technical occupations in art, culture, recreation and sport",22.5,43,40,22,55,Reading,Digital Technology,Oral Communication,7,10,7,3,7,4,4,17,10,21,7,20,16,16,9,0,0,0,20,1645,0,95,0,0,0,0,130,0,0,0,0,0,20,1645,0,95,0,0,0,0,0,0,0,0,0,130,0
236,5244,Artisans and craftspersons,Aboriginal art carver ,Aboriginal craftwork instructor ,"artificial flower maker, hand ","Aboriginal art carverAboriginal craftwork instructorartificial flower maker, handartificial flower presserartisanartistic bouquet designerartistic floral arrangerartistic floral bouquet designerartistic floral designerarts and crafts teacher (except education)bag maker - arts and craftsbalalaika makerbasket weaverbatik artisanbeadworker, handbellows makerbookbinder, handcandle maker, handcaner, custom furniturecanoe builder - arts and craftscanoe repairer - arts and craftscanoe repairman - arts and craftscanoe repairwoman - arts and craftscarvercarver, Native artcarver, totem polescase maker, handcello makerceramic artistceramic potterceramics teacher (except education)ceramistcopperplate engraver - artisancraft instructor (except education)craftsmancraftsman/womancraftspersoncraftswomancraft weavercrocheter, handcustom furniture canerdecorative engraverdollmaker, handdrum maker - artisanembroiderer, handenameller - arts and craftsenameller, handenamellist - arts and craftsengraver, handengraver, metalengraver, pantograph - arts and craftsfabric artisanfabric artistfloral arrangements designerfloral designerglass blowerglass engraverglass novelty makerglass painterglassworker, handgoldsmithguitar makerhand beadworkerhand bookbinderhand candle makerhand carver, stoneshand carver, woodenwarehand case makerhand crocheterhand dollmakerhand embroidererhand enamellerhand engraverhand glassworkerhand knitterhand leather workerhand metalworkerhand needleworkerhand papermakerhand quilterhand rug makerhand silk flower makerhand spinnerhand stone carverhand weaverhand woodworkerharpsichord builderinstructor, crafts (except education)jewellery artisan, handjewellery engraverknitter, handlace weaver - arts and craftsleather workerleather worker, handmachine engraver - arts and craftsmandolin makermaster glass blowermaster glassmakermetal arts workermetal engraver",1025,0,2.333333333,0.751,125,"Occupations in art, culture, recreation and sport",2,"Technical occupations in art, culture, recreation and sport",16.13,34,32,18,41,Reading,Reading,Oral Communication,4,9,6,3,7,3,4,13,9,17,4,13,17,11,5,275,0,0,0,585,0,30,70,0,0,55,10,0,250,0,0,0,0,585,0,30,70,0,0,0,0,0,25,0,55,10,0
237,5252,Coaches,amateur athletics team coach ,amateur sports team coach ,amateur track and field team coach ,"amateur athletics team coachamateur sports team coachamateur track and field team coachathletic boxing trainerathletics coachathletics team coachbaseball coachbaseball manager-coachbaseball scoutbaseball team coachbasketball scoutbasketball team coachbobsled coachbobsleigh coachboxing trainercoachcoach, amateur athletics teamcoach, amateur sports teamcoach, amateur track and field teamcoach, athleticscoach, athletics teamcoach, baseballcoach, baseball teamcoach, basketball teamcoach, bobsledcoach, bobsleighcoach, figure skatingcoach, footballcoach, football teamcoach, gymnasticscoach, hockeycoach, hockey teamcoach, junior hockeycoach, lacrossecoach, lacrosse teamcoach, lugecoach, national teamcoach, professional sports teamcoach, professional teamcoach, provincial teamcoach, skicoach, sportscoach, swimcoach, swimmingcoach, team of professional athletescoach, tenniscoach, track and fieldcoach, track and field athletescoach, track and field teamcoach, volleyballcycling coachfigure skating coachfootball coachfootball scoutfootball team coachgymnastics coachhead coachhockey coachhockey scouthockey team coachinstructor, lugejunior hockey coachkickboxing trainerlacrosse coachlacrosse scoutlacrosse team coachluge coachluge instructormanager-coach, baseballnational team coachprofessional sports scoutprofessional sports team coachprofessional team coachprovincial team coachscout, baseballscout, basketballscout, footballscout, hockeyscout, lacrossescout, professional sportsscout, sportsski coachsoccer coachsports coachsports scoutswim coachswimming coachteam coach, professional athletestennis coachtrack and field athletes coachtrack and field coachtrack and field team coachtrainer, athletic boxingtrainer, boxingtrainer, kickboxingvolleyball coachwater-polo coach",845,0,3.757575758,0.013,159,"Occupations in art, culture, recreation and sport",2,"Technical occupations in art, culture, recreation and sport",21.63,43,40,22,55,Reading,Digital Technology,Oral Communication,7,10,7,3,7,4,4,17,10,21,7,20,16,16,9,0,0,25,110,20,0,40,155,0,380,0,115,0,0,0,0,25,110,20,0,40,155,0,0,0,380,0,0,0,0,115,0
