337,7444,Pest controllers and fumigators,animal control trapper ,exterminator ,"exterminator, pests ","animal control trapperexterminatorexterminator, pestsfumigatorfumigator, pestsnuisance control trapperpest controllerpest control operatorpest control representativepest control service representativepest control technicianpest control trapperpest extermination representativepest exterminatorpest fumigator",160,1,1.4,0.66,125,"Trades, transport and equipment operators and related occupations",3,"Other installers, repairers and servicers and material handlers",20.28,33,32,16,44,Document Use,Reading,Reading,5,9,9,6,5,6,3,12,8,16,2,9,19,16,0,160,0,0,0,0,0,0,0,0,0,0,0,0,160,0,0,0,0,0,0,0,0,0,0,0,0,0,0,0,0,0,0
338,7445,Other repairers and servicers,accordion repairer ,accordion repairman ,accordion repairwoman ,"accordion repaireraccordion repairmanaccordion repairwomanadding machine repaireradding machine repairmanadding machine repairwomanadjuster, golf club headsadjuster, piano actionair compressor repairerair compressor repairmanair compressor repairwomanairport equipment maintenance repairerairport equipment maintenance repairmanairport equipment maintenance repairwomanair valve repairer, railway rolling stockair valve repairman, railway rolling stockair valve repairwoman, railway rolling stockarchery bow finisherarchery bow repairerarchery bow repairmanarchery bow repairwomanautomobile wreckerautomotive dismantlerautomotive maintenance equipment servicerawning and tent repairerawning and tent repairmanawning and tent repairwomanbeer-dispensing equipment repairerbeer-dispensing equipment repairmanbeer-dispensing equipment repairwomanbelt repairer, industrialbelt repairman, industrialbelt repairwoman, industrialbicycle mechanicbicycle repairerbicycle repairmanbicycle repairwomanbilliard and bowling equipment installer-repairerbilliard and bowling equipment installer-repairmanbilliard and bowling equipment installer-repairwomanbilliard cue weigherbilliard table repairerbilliard table repairmanbilliard table repairwomanbilliard table servicerboat propeller repairerboat propeller repairmanboat propeller repairwomanbow repairerbow repairmanbow repairwomancalibrator, pressure controllerscalibrator, torque wrenchcamera repairercamera repairmancamera repairman/womancamera repairwomandictaphone repairerdictaphone repairmandictaphone repairwomandictaphone servicerdismantler, automotivedomestic sewing machine mechanicdomestic sewing machine repairerdomestic sewing machine repairmandomestic sewing machine repairwomanelectric sign repairerelectric sign repairmanelectric sign repairwomanelectric toy repairerelectric toy repairmanelectric toy repairwomanfarebox repairerfarebox repairmanfarebox repairwomanfinisher, archery bows - sporting goods manufacturingfire equipment repairerfire equipment repairmanfire equipment repairwomanfire equipment servicerfire extinguisher repairerfire extinguisher repairmanfire extinguisher repairwomangas meter repairergas meter repairmangas meter repairwomangas meter servicergas meter testergolf club head adjustergolf club repairergolf club repairmangolf club repairwomanguitar repairerguitar repairmanguitar repairwomangyroscope repairergyroscope repairmangyroscope repairman/womangyroscope repairwomanhand tool repairman",405,1,1.8,0.5,101,"Trades, transport and equipment operators and related occupations",3,"Other installers, repairers and servicers and material handlers",18,17,30,17,37,Reading,Decision Making,Decision Making,2,11,7,3,4,6,5,9,9,17,2,4,11,11,0,125,125,0,0,20,0,110,0,25,0,0,0,0,0,0,0,0,0,20,0,110,0,125,25,0,0,0,125,0,0,0,0
339,7452,Material handlers,ash handler ,"attendant, used building materials yard ",automated storage and retrieval system operator ,"ash handlerattendant, used building materials yardautomated storage and retrieval system operatorautomatic pallet equipment operatorbandoleer packer - explosives manufacturingbelt conveyor attendantbeltmanbeltman/womanbeltwomanbin attendantbin fillerbinmanbinman/womanbinwomanbox banderboxcar loaderbox fillerbucket elevator operatorbulk materials carrier operatorbulk materials loader operatorbulk materials unloaderbundler, handcar loader, railwaycarrier operator, bulk materialscement loader and sackercoal conveyor operatorcoal conveyor operator - surface miningcoal dumpercoal handlercoal loader-unloadercoal-moving equipment operatorcoal wheelerconveyor belt attendantconveyor belt operator (except underground mines)conveyor belt patroller-controllerconveyor console operatorconveyor operator, grainconveyor operator - material handling (except underground mines)conveyor tender - material handling (except underground mines)cribber - grain elevatordisposal worker - warehousedockman - truck transportdockman/woman - truck transportdockwoman - truck transportdumper - material handlingdumper - surface coal miningelectric dolly operatorelectric mule operatorelectric truck operatorexplosives handlerexplosives packerexpress service handler (except air transport)fats and oils loaderfeed mill loaderforklift operatorforklift truck operatorfreight car loaderfreight car unloaderfreight handler (except air transport)freight loader (except air transport)freight unloader (except air transport)furniture loader-unloaderfurniture moverglass cut-off machine unloadergrain conveyor operatorgrain handlergrain weigherhand bagger - material handlinghand bundlerhandler, explosiveshandler, freight (except air transport)handler, grainhandler, heavy materialshandler, light materialshandler, materialshandler, materials - manufacturing and warehousinghandler, recycled paperhand packagerhand packer, sacks - material handlinghand sacker - material handlinghand truck operatorheavy materials handlerhelper, stockhelper, stock-keeperhelper, warehouse keeperhousehold goods moverindustrial truck operatorjack lift operatorjigger operator, supermarketjitney driver - material handlinglabourer - material handlinglabourer - warehousing and storagelift driverlift jack operatorlift scoop operatorlift truck operatorlight materials handlerliquids loader-unloaderloader, fats and oilsloader, freight (except air transport)",15930,1,2.356083086,0.85,87,"Trades, transport and equipment operators and related occupations",3,"Other installers, repairers and servicers and material handlers",15,25,27,12,23,Document Use,Decision Making,Reading,0,11,6,2,6,1,3,7,8,9,2,5,20,7,0,2040,2055,360,475,620,660,4400,240,1015,165,495,3405,0,85,125,0,360,475,620,660,4400,240,2055,1015,0,100,0,1830,65,495,3405,0
340,7511,Transport truck drivers,automobile carrier driver ,automobile transport driver ,bulk goods truck driver ,"automobile carrier driverautomobile transport driverbulk goods truck driverbulk milk truck drivercement truck driver - constructioncoal hauler (except underground mining)driver, bulk milk truckdriver, dump truckdriver, explosives truckdriver, gravel truckdriver, heavy truckdriver, line-hauldriver, logging truckdriver, long hauldriver, low-bed semi-trailerdriver, mobile concrete mixerdriver, ready-mix - constructiondriver, ready-mix truckdriver, tow truckdriver, transportdriver, truckdriver, truck-trailerdumpster truck driverdump truck driverexplosives truck driverflatbed truck driverfreight truck driverfuel oil truck drivergasoline truck operatorgravel haulergravel truck driverhauler, gravelheavy truck driverhydrovac truck operatorLCV (long combination vehicule) driverline-haul driverliquid fertilizer truck driverlogging truck driverlog haulerlog truck driverlong combination vehicule (LCV) driverlong distance truck driverlong haul driverlong haul driver, grocerieslong haul tractor-trailer driverlong haul truck driverlow-bed semi-trailer drivermobile cement mixer drivermobile concrete mixer drivermoving truck drivermoving van drivermuskeg tractor operatoroil transport driveroperator, gasoline truckoperator, truckready-mix driver - constructionready-mix truck drivershort haul truck drivershunter truck drivershunter - truckingshunt truck drivertank truck drivertow truck drivertractor-trailer driver, long haultractor-trailer truck drivertransport drivertruck drivertruck driver, bulk milktruck driver, cement - constructiontruck driver, dangerous goodstruck driver, explosivestruck driver, flatbedtruck driver, freighttruck driver, heavy trucktruck driver, liquid fertilizertruck driver, long distancetruck driver, long haultruck driver, ready-mixtruck driver, tractor-trailertruck driver, truck-trailertruckertruck mixer driver - constructiontruck operatortruck owner operatortruck-trailer driver",29285,0,2.203804348,0.79,125,"Trades, transport and equipment operators and related occupations",3,Transport and heavy equipment operation and related maintenance occupations,20,34,32,18,41,Reading,Reading,Oral Communication,4,9,6,3,7,3,4,13,9,17,4,13,17,10,5,6450,3325,55,340,400,765,13860,305,840,20,260,2665,0,880,145,0,55,340,400,765,13860,305,3325,840,0,20,0,5425,0,260,2665,0
341,7513,Taxi and limousine drivers and chauffeurs,airport limousine driver ,"chauffeur, private household ",company chauffeur ,"airport limousine driverchauffeur, private householdcompany chauffeurdriver, funeral servicesdriver, hearsedriver, taxidriver, taxicabfuneral chauffeurfuneral driverhearse driverlimousine driverprivate chauffeurtaxicab drivertaxi drivertaxi owner-operator",5240,0,2.795774648,0.89,117,"Trades, transport and equipment operators and related occupations",3,Transport and heavy equipment operation and related maintenance occupations,13,32,30,17,38,Document Use,Reading,Oral Communication,3,9,6,3,7,3,4,13,8,16,4,11,17,9,5,640,1165,20,355,65,155,1370,65,190,0,35,1180,0,0,0,0,20,355,65,155,1370,65,1165,190,0,0,0,640,0,35,1180,0
342,7514,Delivery and courier service drivers,amusement machine route agent ,bakery deliveryman ,bakery deliveryman/woman ,"amusement machine route agentbakery deliverymanbakery deliveryman/womanbakery deliverywomanbakery route salesmanbakery route salesman/womanbakery route saleswomanbookmobile driverbread delivererbread route drivercanteen drivercourier drivercourier service drivercourier van driverdairy route salesmandairy route salesman/womandairy route saleswomandelivery driverdelivery driver, fast fooddelivery driver - parcelsdeliveryman, bakerydeliveryman/woman, bakerydelivery salespersondelivery truck driverdeliverywoman, bakerydriver, courier servicedriver, fast food servicedriver salesmandriver salesman/womandriver salespersondriver saleswomandriver, small vansdrug store delivery driverdry cleaning driverexpedite driverfast food delivery driverfood delivery driverfood service drivergroceries delivererlaundry route drivermail service couriermilk deliverermilkmanmilkman/womanmilkwomanmobile canteen drivermobile caterermotorized mail couriernewspaper delivery driverparts delivery driverpizza delivery driverroute driversoft drink driver-salesmansoft drink driver-salesman/womansoft drink driver-saleswomansoft drinks drivertakeout pizza drivertelephone directory deliverer - courier servicetown messenger drivervending machine driver-supplier",6485,0,2.126582278,0.69,127,"Trades, transport and equipment operators and related occupations",3,Transport and heavy equipment operation and related maintenance occupations,15,35,32,18,42,Reading,Reading,Oral Communication,4,9,6,3,7,3,4,14,9,17,5,13,17,11,5,1000,670,0,250,145,220,2080,25,595,35,215,1250,0,40,20,20,0,250,145,220,2080,25,650,595,0,35,0,940,0,215,1250,0
343,7521,Heavy equipment operators (except crane),aerial tram operator ,apprentice heavy equipment operator ,asphalt batch plant operator ,"aerial tram operatorapprentice heavy equipment operatorasphalt batch plant operatorasphalt-grooving machine operatorasphalt-paving machine operatorasphalt-paving screed operatorasphalt plant operatorasphalt roller operatorasphalt spreader operatorasphalt street paver operatorbackhoe operatorbituminous paver operator - heavy equipmentbobcat operatorboom-conveyor operatorbucketwheel-excavator operatorbucketwheel operatorbuggy-operator skinnerbuggy-scraper operatorbulldozer driverbulldozer operatorcaterpillar car operatorcaterpillar operatorcat operatorcat skinnerconcrete-grooving machine operatorconcrete-paving machine operatorconcrete spreader operator - heavy equipmentconstruction equipment operatorcontinuous bucket excavator operatorcrawler tractor operatorditcher operator - constructionditching machine operatordozer operatordredge operatordredge runnerearth-moving equipment operatorelectrical equipment operator - shovelelevating grader operatorelevating scraper operatorequipment operator, heavy-dutyexcavating machine operatorexcavator operatorfront end loader operatorgradall operatorgrader operatorgroove-cutting machine operatorgrooving machine operator - heavy equipmenthammer operator, pile drivingheater-planer operatorheavy construction-equipment operatorheavy-duty equipment operatorheavy-duty equipment operator apprenticeheavy equipment operatorheavy equipment operator apprenticeho-ram operatorhorizontal earth-boring machine operatorhydraulic excavator operatorindustrial backhoe operatorloader operator - constructionmarine railway operatormining shovel operator (except underground)mole operatormucker operator - constructionmucking machine operator - constructionoperating engineer, heavy equipmentoperator, asphalt plantoperator, heavy construction-equipmentoperator, pile-driving hammeroperator, side boom tractorpaver operatorpayloader operatorpeat-moss-cutting machine operatorpeat-moss-gathering machine operatorpile driver winch operatorpile-driving hammer operatorpipelayer operatorpower grader operatorpower shovel operatorpulvimixer operatorripper operator - heavy equipmentroad grader operatorroad mixer operatorroad planer operatorroad roller operatorroller operatorrotary trencher operatorscarifier operatorscraper operatorscreed operator, asphalt pavingshield operatorshovel operator - heavy equipmentside boom operator - pipeline constructionside boom tractor operatorsnow-grooming machine operatorspreader operator - heavy equipmentstacker operator - heavy equipmentstreet paver, asphalt operatorstreet paver operatorstripping shovel operatorstructural hydraulic jack erector",4455,0,1.467741935,0.892,125,"Trades, transport and equipment operators and related occupations",3,Transport and heavy equipment operation and related maintenance occupations,31.5,34,32,18,41,Reading,Reading,Oral Communication,4,9,6,3,7,3,4,13,9,18,4,12,18,10,6,860,105,0,0,0,15,3325,0,80,0,0,70,0,45,15,0,0,0,0,15,3325,0,105,80,0,0,0,800,0,0,70,0
344,7522,Public works maintenance equipment operators and related workers,collection truck driver - public works ,drain roto serviceman - public works ,drain roto servicer - public works ,"collection truck driver - public worksdrain roto serviceman - public worksdrain roto servicer - public worksdrain roto servicewoman - public worksdriver, sprinkling truck - public workselectrical foresterequipment operator - municipal public workgarbage collector - drivergarbage truck drivergarbage truck driver - public workshighway snowplough operatorhighway snow removal equipment operatormaintenance equipment operator - public worksmechanical sweeper operator - public worksmunicipal maintenance equipment operatormunicipal serviceman drain rotomunicipal servicer drain rotomunicipal servicewoman drain rotopower pole inspectorpower sweeper operator - public workspublic works maintenance equipment operatorrecycling truck driverrecycling truck driver - public worksrefuse truck driver - public worksroad snowplough operator - public workssalt truck operatorsalt truck operator - public workssanding truck operator - public workssand spreader operatorsand spreader operator - public workssanitation truck driversewer flusher operator-driver - public workssewer-flushing truck operatorsewer-flushing truck operator - public workssewer jet cleaner operator - public workssewer jet machine operator - public workssewer-pipe-cleaning machine operator - public workssnowplough operator, highwaysnowplough operator, road - public workssnow removal equipment operator - public workssprinkling truck driver - public worksstreet flusher operatorstreet flusher operator - public worksstreet sprinkler operator - public worksstreet sweeper operatorstreet sweeper operator - public worksurban snow removal equipment operator - public worksutility arboristutility foresterutility locatorutility pole inspectorutility pole testerutility tree trimmerutility tree worker",1410,0,1.4,0.9,127,"Trades, transport and equipment operators and related occupations",3,Transport and heavy equipment operation and related maintenance occupations,20.14759093,35,32,19,42,Document Use,Reading,Oral Communication,4,9,6,3,7,3,4,13,9,17,5,13,18,11,6,485,35,0,0,0,0,835,0,55,0,0,0,0,125,100,0,0,0,0,0,835,0,35,55,0,0,0,260,0,0,0,0
345,7531,Railway yard and track maintenance workers,aligner-tamper operator - railway ,anchor-applicator operator - railway ,"attendant, locomotives - railway yard ","aligner-tamper operator - railwayanchor-applicator operator - railwayattendant, locomotives - railway yardautomatic anchor-applicator operator - railwayballast-equalizer operator - railwayballast-leveller operator - railwayballast regulator operator - railwaycar controller - railwaycar retarder operator - railway yardcontroller, cars - railwaycontroller, railway cars - railway yardcontroller, tank cars - railway yardcontrol tower operator - railwaycoupler - railway yarddistributor, freight cars - railway yarddistributor, railway carsequipment operator, railwayfitter tracks - railwayfreight car distributor - railway yardgandy dancer - railwaygreaser, journal boxes - railway yardgreaser, railway carsgrinder operator, rails - railwaygrinder, rails - railwayinspector, railway linesinterlocking cabin switcher - railway yardinterlocking signal box switcher - railway yardjournal box greaser - railway yardlag bolter operator - railwaylocomotive attendant - railway yardlocomotive distributor - railway yardlocomotive engine servicerlocomotive maintenance attendantlocomotive servicerlubricator, railway carsmachine operator - railwaymaintenance equipment operator, railway trackmaintenance of way employee - railwaymaintenance of way inspector - railwaymechanical tamper operator - railwaymotor vehicle operator - pole yardoiler, railway carsoperator, mechanical tamper - railwayoperator, railway equipmentoperator, railway tie injectoroperator, retarder - railway yardoperator, track liner - railwayoperator, track maintenance machine - railwayoperator, track-surfacing machine - railwayoperator, turntable - railway yardpatroller, railway trackrail-aligner operator - railwayrail-grinder operator - railwayrail grinder - railwayrail-lifter operator - railwayrail sanderrail saw operatorrail saw operator - railwayrailway car controller - railway yardrailway car distributorrailway car greaserrailway car lubricating specialistrailway car lubricatorrailway car oilerrailway line inspectorrailway maintenance equipment operatorrailway signalmanrailway signalman/womanrailway signalwomanrailway tank car servicerrailway-tie-injector operatorrailway tie inspectorrailway track inspectorrailway track maintenance equipment operatorrailway track maintenance workerrailway trackmanrailway trackman/womanrailway track patrollerrailway track repairerrailway track repairmanrailway track repairwomanrailway track tamper operatorrailway trackwomanrailway train engine maintenance workerretarder operator - railway yardsection worker - railwayservicer, locomotivessignalman, railwaysignalman - railway transportsignalman/woman, railwaysignalman/woman - railway transportsignal tower operator - railwaysignalwoman, railwaysignalwoman - railway transportsnowblower operator - railwayspike-driver operator - railwayspike machine operator - railwayspike puller machine operator - railwayspiker operator - railwayspiking machine operator - railway",75,0,1,0.895,123,"Trades, transport and equipment operators and related occupations",3,Transport and heavy equipment operation and related maintenance occupations,26.01,34,31,18,40,Document Use,Reading,Oral Communication,4,9,6,3,7,3,4,13,8,17,4,12,18,10,5,20,0,0,0,0,0,55,0,0,0,0,0,0,0,0,0,0,0,0,0,55,0,0,0,0,0,0,20,0,0,0,0
346,7532,Water transport deck and engine room crew,able-bodied seaman ,able-bodied seaman/woman ,able-bodied seawoman ,"able-bodied seamanable-bodied seaman/womanable-bodied seawomanable seaman - except armed forcesable seaman/woman - except armed forcesable seawoman - except armed forcesbarge deckhandboatswainboatswain - water transportboiler tender - shipsdeckhanddeckhand, dredgedeckhand - shipsdredge deckhandengine and boiler room crew member - shipsengine room crew member - shipengine room crew member, shipengine room greaser - marineengine room greaser - water transportengine room mechanical assistant, shipengine room mechanical assistant - shipsferryboat deckhandgreaser, engine roomgreaser, engine room - marinehelmsman - water transporthelmsman/woman - water transporthelmswoman - water transportlog boom tugboat deckhandmarine engineering mechanicmarine engineering technicianmarine engine oilermarine oilermechanical assistant, engine room - shipsmechanical assistant, ship's engine roommechanical assistant - water transportoiler, marineordinary seaman - except armed forcesordinary seaman/woman - except armed forcesordinary seawoman - except armed forcespumpman - shipspumpman/woman - shipspump seamanpump seaman/womanpump seawomanpumpwoman - shipsquartermasterseamanseaman/womanseawomanship boiler tendership engine room greasership engine room mechanical assistantship's carpentership stokership tunnelmanship tunnelman/womanship tunnelwomanship watchmanship watchman/womanship watchwomanstoker - shipstanker pumper - shiptugboat deckhandtunnelman, shiptunnelman/woman, shiptunnel operator, shiptunnelwoman, shipwatchman, shipwatchman/woman, shipwatchwoman, shipwheelsmanwheelsman/womanwheelswoman",15,0,2,0.86,125,"Trades, transport and equipment operators and related occupations",3,Transport and heavy equipment operation and related maintenance occupations,26.87,34,32,18,41,Document Use,Reading,Oral Communication,4,9,6,3,7,3,4,13,9,17,4,12,18,10,6,0,0,0,0,0,0,15,0,0,0,0,0,0,0,0,0,0,0,0,0,15,0,0,0,0,0,0,0,0,0,0,0
347,7534,Air transport ramp attendants,aircraft cleaner ,aircraft groomer ,aircraft refueler ,"aircraft cleaneraircraft groomeraircraft refueleraircraft towing equipment operatorairport ramp attendantbaggage loader - air transportcargo attendant, air transportcargo handler - air transportcargo loader - air transportfreight attendant - air transportgroomer, aircraftramp agent, air transportramp attendant, air transportramp lead hand - air transportramp station attendant - air transportstation attendant, air transport",85,0,1.75,0.99,117,"Trades, transport and equipment operators and related occupations",3,Transport and heavy equipment operation and related maintenance occupations,21,32,30,17,38,Document Use,Reading,Oral Communication,3,9,6,3,7,3,4,12,8,16,4,11,18,9,5,15,0,0,0,0,0,45,0,0,0,0,25,0,0,0,0,0,0,0,0,45,0,0,0,0,0,0,15,0,0,25,0
348,7535,Other automotive mechanical installers and servicers,automobile lubricator ,automotive muffler installer ,automotive radiator installer ,"automobile lubricatorautomotive muffler installerautomotive radiator installerautomotive radiator installer - automotive repairautomotive shock absorber installerautomotive spring installercaterpillar serviceman (except mechanic)caterpillar servicer (except mechanic)caterpillar servicewoman (except mechanic)crane greasercrane oilercrawler track servicerdragline oilerelectric golf cart serviceman (except mechanic)electric golf cart servicer (except mechanic)electric golf cart servicewoman (except mechanic)electric truck serviceman (except mechanic)electric truck servicer (except mechanic)electric truck servicewoman (except mechanic)emergency road servicer, motor vehicleexcavator oilergreasergreaser, heavy truckheavy-duty equipment servicerheavy equipment greaserheavy equipment servicerhostler - transit systeminstaller, automotive shock absorbersinstaller, automotive springsinstaller, mufflerinstaller, radiators - automotive serviceloading shovel oilerlubrication technician - automotive service and repairmuffler installeroil changer - motor vehicle serviceoiler and greaser, crane and draglineoiler - automotive serviceoiler, heavy truckpipeline service truck driverradiator installer - automotive serviceradiator installer - auto repair serviceservicer, heavy equipmentservicer, pipeline equipmentservice truck driver, heavy equipmentshock absorber installershovel oilerspring installerstripping shovel oilertire changer - automotive servicetire repairertire repairer - automotive servicetire repairmantire repairman - automotive servicetire repairwomantire repairwoman - automotive service",625,0,1.333333333,0.59,130,"Trades, transport and equipment operators and related occupations",3,Transport and heavy equipment operation and related maintenance occupations,13.25,36,33,19,43,Reading,Document Use,Oral Communication,4,9,6,3,6,3,4,14,9,18,5,14,17,12,6,455,0,0,0,0,0,120,0,50,0,0,0,0,0,0,0,0,0,0,0,120,0,0,50,0,0,0,455,0,0,0,0
