noc,job,workers,minEduc,yearsStudy,automationRisk,totalSkill,industry,cluster,sector,wage,skillsComp,skillsLogi,skillsMath,skillsLang,s1 Data Analysis,s2 Decision Making,s3 Finding Information,s4 Job Task Planning and Organizing,s5 Measurement and Calculation,s6 Money Math,s7 Numerical Estimation,s8 Oral Communication,s9 Problem Solving,s10 Reading,s11 Scheduling or Budgeting and Accounting,s12 Digital Technology,s13 Document Use,s14 Writing,s15 Critical Thinking,f1 Science & Agriculture,f2 Engineering,f3 Humanities,f4 Social Science,f5 Fine Arts,f6 Math And Computer Science,f7 Arts & Education,f8 Education   (teacher training)                      ,f9 Law,f10 Health,"f11 Health, Nursing & Clinical Laboratory",f12 Business,"f13 Medical, Dental & Veterinary",d1 Agriculture & Biological Science                    ,d2 Forestry                                            ,d3 Architecture & Landscape Architecture               ,d4 Humanities                                          ,d5 Social Sciences                                     ,d6 Fine & Applied Arts                                 ,d7 Computer Science                                    ,d8 Other Arts & Science                                ,d9 Education   (teacher training)                      ,d10 Engineering                                         ,d11 Law                                                 ,d12 Mathematics                                         ,d13 Kinesiology / Recreation / Physical Education       ,d14 Theology                                            ,d15 Physical Sciences                                   ,d16 Therapy & Rehabilitation                            ,"d17 Health, Nursing & Clinical Laboratory",d18 Business & Commerce                                 ,"d19 Medical, Dental & Veterinary"
11,Legislators,295,3,3.75,0.015,171,Management occupations,1,Senior management occupations,49.05957447,46,43,24,59,8,11,8,3,7,4,5,18,11,23,8,21,17,18,11,0,0,0,35,0,0,0,90,85,0,0,85,0,0,0,0,0,35,0,0,0,90,0,85,0,0,0,0,0,0,85,0
12,Senior government managers and officials,2865,3,3.975903614,0.088,170,Management occupations,1,Senior management occupations,53.57,46,43,24,58,7,10,8,3,7,4,5,18,11,23,8,21,17,17,11,30,210,25,840,20,45,155,50,300,260,0,930,0,0,15,60,25,840,20,35,155,50,150,300,10,15,0,15,245,0,930,0
13,Authors and writers,22945,3,3.873841305,0.063,171.5,"Occupations in art, culture, recreation and sport",2,Professional occupations in art and culture,38.075,42,43,24.5,62,4.5,12,9,3,5.5,5.5,3.5,16.5,10.5,24.5,10,22,15,21,9,365,2010,225,2040,490,980,935,265,510,20,70,8545,0,100,0,50,190,2040,490,695,935,265,1960,510,285,20,35,265,0,70,8545,0
14,"Automotive service technicians, truck and bus mechanics and mechanical repairers                                     ",43915,1.5,3.040179003,0.35,149.5,"Trades, transport and equipment operators and related occupations",3,Maintenance and equipment operation trades,32.76,44.5,38,19,47.5,6.5,9,7.5,2.5,6.5,2.5,6.5,14,9,21.5,4,21.5,16.5,12,10,20,30,295,720,100,85,160,530,205,640,455,1810,0,20,0,0,240,720,100,40,160,530,30,205,45,150,55,0,490,455,1810,0
15,"Senior managers - trade, broadcasting and other services, n.e.c.",8805,0,3.357142857,0.088,170,Management occupations,1,Senior management occupations,52.3,46,42,24,58,7,10,8,3,7,4,5,18,11,23,8,21,17,17,10,275,880,70,1015,145,260,925,170,155,90,75,4745,0,60,0,15,70,1015,145,210,925,170,865,155,50,70,0,215,20,75,4745,0
16,Furniture finishers and refinishers,9695,0,2.927672956,0.479,145,Management occupations,1,Senior management occupations,35.44,39.5,37,21,48.5,5.5,9.5,7,3,7,3.5,4.5,15.5,9.5,20,6,16.5,17.5,13.5,7.5,555,2430,50,555,130,110,1275,95,60,70,0,4310,0,55,0,165,50,555,130,50,1275,95,2265,60,60,70,0,500,0,0,4310,0
111,Financial managers,25715,0,3.448412698,0.069,167,Management occupations,1,Specialized middle management occupations,44.87,45,42,23,57,7,10,8,3,7,4,5,18,11,23,8,21,17,17,10,230,410,140,2195,305,895,675,390,485,245,255,19490,0,60,25,0,140,2195,305,485,675,390,410,485,410,90,0,145,155,255,19490,0
112,Human resources managers,13860,0,3.493617021,0.006,196,Management occupations,1,Specialized middle management occupations,43.27,34,50,21,91,8,12,17,4,0,0,6,27,17,33,15,16,10,31,0,130,390,230,2095,415,105,685,510,380,320,475,8125,0,70,25,0,230,2095,415,90,685,510,390,380,15,105,0,35,215,475,8125,0
113,Purchasing managers,2635,0,3.5,0.03,158,Management occupations,1,Specialized middle management occupations,36.47605804,42,40,22,54,7,10,7,3,7,3,4,17,10,21,7,19,17,16,9,0,230,0,160,0,25,155,0,10,0,0,2055,0,0,0,0,0,160,0,15,155,0,230,10,10,0,0,0,0,0,2055,0
114,Other administrative services managers,4955,0,3.477272727,0.73,137,Management occupations,1,Specialized middle management occupations,40.87,37,35,20,45,5,9,6,3,7,3,4,14,9,19,5,14,18,12,7,35,260,75,635,125,90,325,230,435,115,150,2480,0,15,0,40,75,635,125,90,325,230,220,435,0,40,0,20,75,150,2480,0
121,"Insurance, real estate and financial brokerage managers                                                              ",10105,0,3.21761658,0.81,139,Management occupations,1,Specialized middle management occupations,52.82,38,35,20,46,5,9,6,3,7,3,5,14,9,19,5,14,18,12,8,80,380,205,1430,300,300,505,125,330,75,170,6205,0,15,0,135,205,1430,300,190,505,125,245,330,110,60,0,65,15,170,6205,0
122,Labourers in food and beverage processing,27375,0.5,2.916601153,0.3645,131.5,Management occupations,1,Specialized middle management occupations,29.14,36,33,19.5,43,6.5,8.5,7.5,2.5,7,4,4,14.5,9.5,17.5,5,11.5,18,11.5,5,175,550,445,3315,410,1040,1185,330,520,75,250,15675,0,120,35,15,435,3315,410,680,1185,330,535,520,360,30,10,20,45,250,15675,0
124,"Advertising, marketing and public relations managers                                                                 ",19670,0,3.593059937,0.023,166,Management occupations,1,Specialized middle management occupations,38.46,45,42,23,57,7,10,8,3,7,4,5,18,11,22,8,21,17,17,10,210,850,450,4710,2235,360,1260,260,235,230,120,8750,0,90,45,35,380,4710,2235,295,1260,260,815,235,65,200,70,75,30,120,8750,0
125,Other business services managers,1665,0,3.338709677,0.232,151,Management occupations,1,Specialized middle management occupations,32.68485074,41,38,21,51,6,10,7,3,7,3,4,16,10,21,6,18,17,15,8,0,80,20,160,80,15,105,0,120,0,0,1085,0,0,0,0,20,160,80,15,105,0,80,120,0,0,0,0,0,0,1085,0
131,Telecommunication carriers managers,2895,0,3.5,0.25,158,Management occupations,1,Specialized middle management occupations,41.6,43,40,22,54,6,10,7,3,7,3,5,17,10,21,7,19,17,16,9,15,1020,0,290,40,280,90,0,20,0,0,1140,0,0,0,0,0,290,40,220,90,0,1020,20,60,0,0,15,0,0,1140,0
132,Announcers and other broadcasters,950,0,2.971428572,0.345,147.5,"Occupations in art, culture, recreation and sport",2,"Technical occupations in art, culture, recreation and sport",26.12289018,40,37,21,50,6,9.5,6.5,3,7,3.5,4,16,9.5,20,6,17,17,14.5,8,0,0,0,0,0,0,0,0,0,0,0,285,0,0,0,0,0,0,0,0,0,0,0,0,0,0,0,0,0,0,285,0
211,Engineering managers,5620,0,3.725274725,0.017,174,Management occupations,1,Specialized middle management occupations,55.29,47,44,24,60,8,11,8,3,7,4,5,18,11,24,8,22,17,18,11,110,4800,0,15,0,95,125,0,0,0,0,475,0,15,40,15,0,15,0,95,125,0,4785,0,0,0,0,55,0,0,475,0
213,Computer and information systems managers,19900,0,3.529850746,0.035,170,Management occupations,1,Specialized middle management occupations,48.72,46,43,24,58,7,11,8,3,7,4,5,18,11,23,8,21,17,18,10,745,4155,160,1040,380,7800,1050,75,75,75,25,4320,0,175,25,15,145,1040,380,7005,1050,75,4140,75,795,75,15,545,0,25,4320,0
311,Managers in health care,6665,0,3.77443609,0.007,169,Management occupations,1,Specialized middle management occupations,43.27,45,42,23,58,7,11,8,3,7,4,5,18,11,23,8,21,17,17,10,180,15,65,390,15,0,260,205,25,380,4305,750,75,180,0,15,65,390,15,0,260,205,0,25,0,75,0,0,305,4305,750,75
411,Government managers - health and social policy development and program administration,540,0,4.48,0.25,162,Management occupations,1,Specialized middle management occupations,50.26,43,41,23,55,7,10,7,3,7,4,5,17,10,22,7,19,18,16,10,30,0,0,180,0,0,30,25,15,105,70,85,0,15,15,0,0,180,0,0,30,25,0,15,0,0,0,0,105,70,85,0
412,"Government managers - economic analysis, policy development and program administration                               ",1565,0,3.925925926,0.25,165,Management occupations,1,Specialized middle management occupations,58.01,44,41,23,56,7,10,7,3,7,4,5,17,10,23,7,20,18,16,10,120,45,0,515,20,0,40,20,115,95,0,595,0,25,95,45,0,515,20,0,40,20,0,115,0,35,0,0,60,0,595,0
413,Government managers - education policy development and program administration,25,0,5,0.25,161,Management occupations,1,Specialized middle management occupations,49.14,43,40,23,55,7,10,7,3,7,4,5,17,10,22,7,19,17,16,10,0,0,0,0,0,0,0,25,0,0,0,0,0,0,0,0,0,0,0,0,0,25,0,0,0,0,0,0,0,0,0,0
414,Accounting and related clerks,35595,0.5,3.47903479,0.615,141.5,"Business, finance and administration occupations",4,Office support occupations,38.02,39.5,33.5,22.5,46,5,9.5,6,2.5,4,5,4,14.5,6.5,18,9.5,20.5,14.5,13,8.5,10,180,35,415,0,0,20,50,110,165,20,360,0,10,0,0,35,415,0,0,20,50,180,110,0,0,0,0,165,20,360,0
422,School principals and administrators of elementary and secondary education,10975,0,4.314606742,0.01,170,Management occupations,1,Specialized middle management occupations,46.5,46,43,24,59,7,11,8,3,7,4,5,18,11,23,8,21,17,18,10,45,55,180,320,215,10,265,9370,0,165,0,350,0,45,0,10,155,320,215,0,265,9370,45,0,10,165,25,0,0,0,350,0
423,"Managers in social, community and correctional services                                                              ",5250,0,3.583333333,0.007,159,Management occupations,1,Specialized middle management occupations,36.90773016,43,40,22,54,7,10,7,3,7,3,5,17,10,22,7,19,17,16,9,30,0,1035,1250,105,0,195,465,235,1015,215,705,0,15,15,0,1015,1250,105,0,195,465,0,235,0,135,20,0,880,215,705,0
431,Commissioned police officers,110,0,2.8,0.098,170,Management occupations,1,Specialized middle management occupations,53.67,46,43,24,58,7,10,8,3,7,4,5,18,11,23,8,21,17,17,10,0,0,0,0,0,0,0,0,100,0,0,10,0,0,0,0,0,0,0,0,0,0,0,100,0,0,0,0,0,0,10,0
432,Fire chiefs and senior firefighting officers,255,0,2.166666667,0.004,159,Management occupations,1,Specialized middle management occupations,36.96403522,43,40,22,54,7,10,7,3,7,3,5,17,10,22,7,19,17,16,9,70,0,0,0,0,0,0,0,165,20,0,0,0,0,0,0,0,0,0,0,0,0,0,165,0,0,0,70,20,0,0,0
433,Commissioned officers of the Canadian Forces,4005,0,4,0.311309013,145,Management occupations,1,Specialized middle management occupations,38,39,37,21,49,6,9,7,3,7,3,4,15,10,20,6,16,17,13,8,295,695,360,555,75,75,875,135,125,0,80,715,20,75,0,0,360,555,75,65,875,135,695,125,10,0,0,220,0,80,715,20
511,"Library, archive, museum and art gallery managers                                                                    ",445,0,4.583333333,0.25,156,Management occupations,1,Specialized middle management occupations,38.23,42,39,22,53,6,10,7,3,7,3,5,16,10,21,7,19,17,15,9,0,0,20,0,60,45,305,0,0,0,0,15,0,0,0,0,20,0,60,45,305,0,0,0,0,0,0,0,0,0,15,0
512,"Managers - publishing, motion pictures, broadcasting and performing arts                                             ",1585,0,3.555555556,0.25,155,Management occupations,1,Specialized middle management occupations,34.62,42,39,22,53,6,10,7,3,7,3,4,16,10,21,7,18,17,15,9,0,15,40,375,760,0,120,0,0,0,0,275,0,0,0,0,40,375,760,0,120,0,15,0,0,0,0,0,0,0,275,0
513,"Recreation, sports and fitness program and service directors                                                         ",1645,0,3.023809524,0.25,150,Management occupations,1,Specialized middle management occupations,32.34702038,40,38,21,51,6,10,7,3,7,3,4,16,10,20,6,17,17,15,8,10,0,25,90,30,0,85,80,0,985,15,325,0,10,0,0,25,90,30,0,85,80,0,0,0,985,0,0,0,15,325,0
631,"Assemblers, fabricators and inspectors, industrial electrical motors and transformers",31670,0,2.872796996,0.064,207.5,"Occupations in education, law and social, community and government services",5,"Care providers and educational, legal and public protection support occupations",15.75,57,47.5,30,73,12,14.5,7,3.5,4,5,5.5,24,12,25,15.5,32,13,23.5,10.5,275,960,1045,1515,675,695,3420,330,685,315,785,8565,0,90,0,15,1030,1515,675,645,3420,330,945,685,50,160,15,185,155,785,8565,0
632,Accommodation service managers,1725,0,3,0.004,261,Management occupations,1,Middle management occupations in retail and wholesale trade and customer services,21.63,72,57,38,94,17,19,7,4,1,6,7,32,14,30,24,45,10,32,13,15,10,20,55,15,0,175,40,0,0,45,1350,0,0,0,0,20,55,15,0,175,40,10,0,0,0,0,15,0,45,1350,0
651,"Managers in customer and personal services, n.e.c.                                                                   ",3395,0,2.584415584,0.171,158,Management occupations,1,Middle management occupations in retail and wholesale trade and customer services,34.68,43,40,22,54,7,10,7,3,7,4,5,17,10,21,7,19,17,16,9,140,75,80,235,105,20,1500,20,0,15,100,1105,0,55,0,0,80,235,105,20,1500,20,75,0,0,0,0,85,15,100,1105,0
711,Construction managers,12420,0,2.620087336,0.071,163,Management occupations,1,"Middle management occupations in trades, transportation, production and utilities",36.86,44,41,23,56,7,10,7,3,7,4,5,17,11,22,7,20,17,17,9,580,6100,40,325,145,30,2960,0,85,70,10,2075,0,60,30,1675,40,325,145,20,2960,0,4425,85,10,70,0,490,0,10,2075,0
712,Home building and renovation managers,4465,0,2.236220472,0.071,275,Management occupations,1,"Middle management occupations in trades, transportation, production and utilities",20,76,61,42,96,15,20,7,4,1,6,7,31,14,30,28,45,16,35,16,505,1190,0,115,80,30,1805,15,55,0,0,670,0,55,0,305,0,115,80,30,1805,15,885,55,0,0,0,450,0,0,670,0
731,Managers in transportation,3820,0,2.838095238,0.59,142,Management occupations,1,"Middle management occupations in trades, transportation, production and utilities",38.46,38,36,20,47,5,9,7,3,7,3,4,15,9,20,6,16,18,13,7,430,405,20,225,100,30,480,0,115,0,40,1975,0,0,0,0,20,225,100,30,480,0,405,115,0,0,0,430,0,40,1975,0
811,Managers in natural resources production and fishing,135,0,2,0.36,159,Management occupations,1,"Middle management occupations in trades, transportation, production and utilities",54.32,43,40,22,54,6,10,7,3,7,3,5,16,10,22,7,19,18,15,9,75,50,0,0,0,0,10,0,0,0,0,0,0,0,45,0,0,0,0,0,10,0,50,0,0,0,0,30,0,0,0,0
822,Managers in horticulture,135,0,2.5,0.47,138,Management occupations,1,"Middle management occupations in trades, transportation, production and utilities",19.31,38,35,20,46,5,9,6,3,7,3,4,15,9,19,6,16,17,13,7,135,0,0,0,0,0,0,0,0,0,0,0,0,135,0,0,0,0,0,0,0,0,0,0,0,0,0,0,0,0,0,0
911,Lumber graders and other wood processing inspectors and graders,17445,0.5,2.508982036,0.5,143,Management occupations,1,"Middle management occupations in trades, transportation, production and utilities",33.4481646,37.5,31.5,21,53,4.5,10,6.5,2.5,6.5,2,8,18.5,7.5,22,5,12,21,12.5,5,1690,6055,205,835,575,425,2455,65,225,40,80,4780,0,425,70,145,185,835,575,330,2455,65,5910,225,95,40,20,1195,0,80,4780,0
912,Utilities managers,1625,0,3.033898305,0.31,161,Management occupations,1,"Middle management occupations in trades, transportation, production and utilities",54.95,43,41,23,55,7,10,7,3,7,3,5,17,10,22,7,19,18,16,10,105,750,0,40,0,0,205,0,0,0,0,525,0,0,0,20,0,40,0,0,205,0,730,0,0,0,0,105,0,0,525,0
1112,Financial and investment analysts,16205,0,3.76744186,0.23,155,"Business, finance and administration occupations",4,Professional occupations in business and finance,33.65,42,39,22,53,6,10,7,3,7,3,4,16,10,21,7,18,17,15,9,75,345,95,1890,40,960,380,35,20,0,60,12305,0,30,20,0,95,1890,40,395,380,35,345,20,565,0,0,25,0,60,12305,0
1113,"Securities agents, investment dealers and brokers                                                                    ",4400,0,3.72826087,0.016,164,"Business, finance and administration occupations",4,Professional occupations in business and finance,32.05,44,41,23,56,7,10,7,3,7,4,5,17,11,22,8,20,17,17,9,35,125,30,785,0,140,205,0,20,0,0,3060,0,0,0,0,30,785,0,80,205,0,125,20,60,0,0,35,0,0,3060,0
1114,Other financial officers,29215,3,3.5,0.33,157,"Business, finance and administration occupations",4,Professional occupations in business and finance,33.33,38,35,29,55,6,8,5,3,0,3,4,21,7,16,22,18,14,18,12,305,835,410,4415,500,685,1475,285,780,180,170,19175,0,180,40,0,345,4415,500,430,1475,285,835,780,255,155,65,85,25,170,19175,0
1121,Human resources professionals,16320,3,3.592885375,0.201,194,"Business, finance and administration occupations",4,Professional occupations in business and finance,32.05,32,50,21,91,8,12,17,4,0,0,6,27,17,33,15,14,10,31,0,95,100,395,2930,405,330,1250,665,600,405,380,8765,0,20,20,0,375,2930,405,175,1250,665,100,600,155,95,20,55,310,380,8765,0
1122,Professional occupations in business management consulting,20890,3,3.843930636,0.071,183,"Business, finance and administration occupations",4,Professional occupations in business and finance,32.69,56,48,22,57,17,10,9,3,7,5,3,20,9,20,7,23,16,17,17,560,2005,250,2575,560,1840,990,255,330,175,110,11240,0,140,25,15,230,2575,560,1385,990,255,1990,330,455,45,20,395,130,110,11240,0
1211,"Supervisors, general office and administrative support workers                                                       ",640,0,2.565217391,0.014,161,"Business, finance and administration occupations",4,Administrative and financial supervisors and administrative occupations,25,43,40,22,55,7,10,7,3,7,4,4,17,10,22,7,20,17,16,9,0,0,30,25,0,0,0,50,45,0,40,450,0,0,0,0,30,25,0,0,0,50,0,45,0,0,0,0,0,40,450,0
1212,Bricklayers,5430,1,2.157574153,0.417,149.5,"Trades, transport and equipment operators and related occupations",3,"Industrial, electrical and construction trades",31.245,43,38,18,50,5,9.5,9.5,2.5,8,2.5,4,16,8,21.5,3.5,21,17.5,13,8,0,0,0,210,0,25,95,35,60,10,0,2240,0,0,0,0,0,210,0,25,95,35,0,60,0,10,0,0,0,0,2240,0
1213,"Supervisors, library, correspondence and related information workers                                                 ",220,0,3.25,0.014,158,"Business, finance and administration occupations",4,Administrative and financial supervisors and administrative occupations,36.77635169,42,40,22,54,7,10,7,3,7,3,4,17,10,21,7,19,17,16,9,0,0,0,0,0,0,35,80,0,0,0,105,0,0,0,0,0,0,0,0,35,80,0,0,0,0,0,0,0,0,105,0
1214,Business development officers and marketing researchers and consultants,16915,1.5,3.013138138,0.122,174.5,"Occupations in education, law and social, community and government services",5,"Professional occupations in law and social, community and government services",34.63817584,51,38.5,20.5,64.5,9,7,8,3,4.5,3,3.5,17,10,25.5,9,26,16.5,22,10,0,40,25,40,0,50,0,0,0,0,15,110,0,0,0,0,25,40,0,50,0,0,40,0,0,0,0,0,0,15,110,0
1215,"Supervisors, supply chain, tracking and scheduling co-ordination occupations                                         ",3270,0,2.752688172,0.014,160,"Business, finance and administration occupations",4,Administrative and financial supervisors and administrative occupations,23,43,40,22,55,7,10,7,3,7,4,4,17,10,21,7,20,16,16,9,95,255,30,320,10,140,375,0,195,15,35,1800,0,0,0,0,30,320,10,140,375,0,255,195,0,15,0,95,0,35,1800,0
1222,Executive assistants,7895,2,3.029761905,0.86,117,"Business, finance and administration occupations",4,Administrative and financial supervisors and administrative occupations,26.44,31,23,15,48,3,4,3,3,1,5,2,10,6,22,7,17,11,16,7,45,15,235,1260,470,90,465,180,480,95,430,4130,0,45,0,15,235,1260,470,60,465,180,0,480,30,15,0,0,80,430,4130,0
1223,Human resources and recruitment officers,6950,2,3.481203008,0.31,123,"Business, finance and administration occupations",4,Administrative and financial supervisors and administrative occupations,30.77,26,27,17,53,5,8,2,2,3,3,5,17,4,23,6,13,8,13,11,25,0,170,1415,185,0,500,205,225,110,25,4090,0,25,0,0,170,1415,185,0,500,205,0,225,0,75,0,0,35,25,4090,0
1224,Architecture and science managers,9740,1,3.481105991,0.4135,136.5,Management occupations,1,Specialized middle management occupations,30.29,35,31.5,23.5,47,4.5,7,6.5,3,8,3.5,3.5,15,7.5,18.5,9,17,13.5,13.5,7.5,285,710,205,970,235,90,1080,395,400,135,345,4040,0,0,0,115,180,970,235,70,1080,395,595,400,20,85,25,285,50,345,4040,0
1226,Conference and event planners,4305,2,3.303571429,0.037,153,"Business, finance and administration occupations",4,Administrative and financial supervisors and administrative occupations,21.68,28,42,10,73,3,15,8,4,1,2,4,28,15,16,3,18,7,29,0,20,0,105,820,520,0,405,60,100,265,35,1975,0,20,0,0,105,820,520,0,405,60,0,100,0,265,0,0,0,35,1975,0
1227,Court officers and justices of the peace,420,0,2.833333333,0.64,134,"Business, finance and administration occupations",4,Administrative and financial supervisors and administrative occupations,26.52,36,34,19,45,5,9,6,3,7,3,4,14,9,18,5,14,17,12,6,0,0,0,20,0,0,0,15,345,0,0,40,0,0,0,0,0,20,0,0,0,15,0,345,0,0,0,0,0,0,40,0
1228,"Employment insurance, immigration, border services and revenue officers                                              ",6835,2,3.306122449,0.418,149,"Business, finance and administration occupations",4,Administrative and financial supervisors and administrative occupations,33.85,33,35,21,60,2,5,5,3,4,3,2,21,7,26,12,15,16,13,15,75,20,170,1595,145,125,335,145,1125,75,170,2855,0,75,0,0,170,1595,145,110,335,145,20,1125,15,35,0,0,40,170,2855,0
1242,Legal administrative assistants,10350,2,2.798076923,0.94,112,"Business, finance and administration occupations",4,Administrative and financial supervisors and administrative occupations,27,27,24,20,41,0,1,6,4,0,7,4,11,6,17,9,15,12,13,7,0,0,130,380,225,35,375,35,7355,35,265,1515,0,0,0,0,130,380,225,35,375,35,0,7355,0,0,0,0,35,265,1515,0
1243,Medical administrative assistants,3465,2,1.98,0.3,141,"Business, finance and administration occupations",4,Administrative and financial supervisors and administrative occupations,22,45,35,17,44,6,8,8,2,0,4,1,10,10,24,12,28,11,10,7,0,0,60,25,30,15,55,0,110,0,2765,405,0,0,0,0,60,25,30,15,55,0,0,110,0,0,0,0,0,2765,405,0
1251,"Court reporters, medical transcriptionists and related occupations                                                   ",1870,0,2.16,0.695,129,"Business, finance and administration occupations",4,Administrative and financial supervisors and administrative occupations,21,35,33,19,43,4,9,6,3,7,3,4,14,9,18,5,14,17,11,6,0,0,15,50,0,0,10,0,275,0,1355,165,0,0,0,0,15,50,0,0,10,0,0,275,0,0,0,0,0,1355,165,0
1252,Health information management occupations,650,0,2,0.91,120,"Business, finance and administration occupations",4,Administrative and financial supervisors and administrative occupations,21.33,33,30,18,39,4,9,6,3,7,3,4,13,8,17,4,12,18,10,5,0,0,0,0,0,0,0,0,0,0,650,0,0,0,0,0,0,0,0,0,0,0,0,0,0,0,0,0,0,650,0,0
1253,Records management technicians,310,0,2.909090909,0.95,119,"Business, finance and administration occupations",4,Administrative and financial supervisors and administrative occupations,22,33,30,18,38,3,9,6,3,7,3,4,13,8,17,4,11,18,9,5,0,0,0,65,0,0,45,0,10,0,25,165,0,0,0,0,0,65,0,0,45,0,0,10,0,0,0,0,0,25,165,0
1254,Binding and finishing machine operators,61165,0,3.288913437,0.81,128.5,"Business, finance and administration occupations",4,Administrative and financial supervisors and administrative occupations,30.23,35,32.5,19,42,4,9,6,3,7,3,4,13.5,8.5,18,4.5,13,18,10.5,6,0,0,0,60,0,15,0,0,0,0,15,210,0,0,0,0,0,60,0,0,0,0,0,0,15,0,0,0,0,15,210,0
1311,Accounting technicians and bookkeepers,28295,0,3.066091954,0.98,116,"Business, finance and administration occupations",4,"Finance, insurance and related business administrative occupations",19.23,32,30,17,37,3,9,6,3,7,3,4,12,8,16,4,11,18,9,5,235,555,450,1615,605,645,1570,1015,720,120,1430,19335,0,135,0,70,450,1615,605,395,1570,1015,485,720,250,25,0,100,95,1430,19335,0
1312,Insurance adjusters and claims examiners,5205,0,3.040983607,0.98,119,"Business, finance and administration occupations",4,"Finance, insurance and related business administrative occupations",26.52,33,30,18,39,3,9,6,3,7,3,4,13,8,17,4,11,18,9,5,185,15,95,855,55,125,515,45,260,205,210,2640,0,45,0,0,95,855,55,30,515,45,15,260,95,165,0,140,40,210,2640,0
1313,Insurance underwriters,3550,0,3.127906977,0.99,120,"Business, finance and administration occupations",4,"Finance, insurance and related business administrative occupations",28.85,33,31,18,39,3,9,6,3,7,3,4,13,8,17,4,11,18,9,5,60,15,85,475,70,75,240,0,75,15,90,2350,0,60,0,0,85,475,70,50,240,0,15,75,25,15,0,0,0,90,2350,0
1315,"Customs, ship and other brokers                                                                                      ",480,0,1.818181818,0.98,116,"Business, finance and administration occupations",4,"Finance, insurance and related business administrative occupations",19.4,32,30,17,38,3,9,6,3,7,3,4,12,8,16,4,11,18,9,5,0,0,0,0,0,0,25,0,120,0,0,335,0,0,0,0,0,0,0,0,25,0,0,120,0,0,0,0,0,0,335,0
1411,"Electronics assemblers, fabricators, inspectors and testers",49645,0.5,3.003988005,0.9625,123,"Business, finance and administration occupations",4,Office support occupations,17.925,38,28,18.5,38.5,3.5,9.5,6,2.5,5,5,2.5,10.5,8.5,16.5,6.5,13,21.5,11.5,2,1015,1150,1600,4475,2330,1610,4560,1755,2040,1135,7130,18895,0,560,150,135,1470,4475,2330,1500,4560,1755,1015,2040,110,495,130,305,640,7130,18895,0
1414,Receptionists,28690,1,2.729591837,0.96,124,"Business, finance and administration occupations",4,Office support occupations,16,40,30,16,38,3,10,8,4,1,4,5,12,8,15,6,15,22,11,0,320,110,1120,1740,1515,620,2765,955,1125,605,9285,8530,0,305,15,30,1090,1740,1515,620,2765,955,80,1125,0,180,30,0,425,9285,8530,0
1415,Personnel clerks,2090,0,3.226415094,0.9,121,"Business, finance and administration occupations",4,Office support occupations,22.79,33,31,18,39,4,9,6,3,7,3,4,13,8,17,4,12,18,10,5,0,0,85,240,15,0,125,0,130,0,30,1465,0,0,0,0,85,240,15,0,125,0,0,130,0,0,0,0,0,30,1465,0
1416,Court clerks,180,0,2.333333333,0.46,142,"Business, finance and administration occupations",4,Office support occupations,26,38,36,20,48,5,10,7,3,7,3,4,15,9,19,6,16,17,13,7,0,0,0,0,0,0,0,0,165,0,0,15,0,0,0,0,0,0,0,0,0,0,0,165,0,0,0,0,0,0,15,0
