102,2145,Aircraft assemblers and aircraft assembly inspectors,"chief engineer, drilling and recovery ",chief petroleum engineer ,drilling and recovery chief engineer ,"chief engineer, drilling and recoverychief petroleum engineerdrilling and recovery chief engineerdrilling and recovery petroleum engineerdrilling engineer, oil and gasengineer, natural gasengineer, oil and gas drillingengineer, petroleumengineer, petroleum productionengineer, petroleum well completionexploitation engineer - oil and gasexploitation engineer - petroleumlogging engineer, oil wellsmud engineermud engineer - petroleum drillingnatural gas engineeroffshore drilling engineeroffshore drilling rig subsea equipment engineeroil and gas drilling engineeroil and gas production engineeroil well logging engineerpetroleum engineerpetroleum engineer, completionpetroleum engineer, drilling and recoverypetroleum engineer, productionpetroleum production engineerpetroleum reservoir engineerpetroleum well completion engineerproduction engineer, oil and gasreservoir engineer, petroleumsubsea engineersubsea equipment engineer, offshore drilling rigwell logging engineer",885,2.5,3.85,0.23,184.5,Natural and applied sciences and related occupations,6,Technical occupations related to natural and applied sciences,31.07975505,52,43,32,57.5,Reading,Digital Technology,Oral Communication,11,13,7,2.5,10,4,10,18.5,9,24,8,23,18,15,11.5,0,20,0,0,0,0,0,0,0,0,0,0,0,0,0,0,0,0,0,0,0,0,20,0,0,0,0,0,0,0,0,0
103,2146,Aerospace engineers,aerodynamics engineer ,aeronautical engineer ,aerospace engineer ,"aerodynamics engineeraeronautical engineeraerospace engineeraerospace engineer - design and developmentaerospace engineer - flight operationsaerospace engineer - flight supportaerospace engineer - flight testaerospace engineer - mass propertiesaerospace engineer - materials and processesaerospace engineer - material stressaerospace engineer - propulsion systemsaerospace engineer, structuresaerospace engineer - systemsaerospace engineer - systems analysisaerospace engineer - weight and balanceaerospace reliability specialistaerospace structural engineeraerospace systems engineeraerospace test engineeraircraft design engineerdesign engineer, aircraftprojects engineer, aeronauticalpropulsion engineer - aerospace vehiclesspace reliability specialiststress engineer - aerospacestructural engineer, aerospacestructures aerospace engineersystems engineer, aerospacetest engineer, aerospaceweight analyst, aircraft design - engineerweight and balance engineer - aerospace",1330,3,4.138888889,0.017,256,Natural and applied sciences and related occupations,6,Professional occupations in natural and applied sciences,38.46,93,64,33,66,Digital Technology,Reading,Document Use,25,11,13,4,17,4,6,19,16,27,6,42,26,20,20,0,1315,0,0,0,0,0,0,0,0,0,15,0,0,0,0,0,0,0,0,0,0,1315,0,0,0,0,0,0,0,15,0
104,2147,Computer engineers (except software engineers and designers),application specific integrated circuit (ASIC) design engineer ,"capacity planner, network ",capacity planning analyst ,"application specific integrated circuit (ASIC) design engineercapacity planner, networkcapacity planning analystcomputer engineercomputer engineer (except software)computer hardware engineercomputer systems engineercomputer telecommunications specialistdata communications specialistengineer, computer (except software)engineer, computer hardwareengineer, hardwareengineer, network systemsengineer, optical communicationsengineer, optical communications hardwareengineer, telecommunications hardwarefibre-optic network designerhardware circuit board designerhardware design engineerhardware development engineerhardware engineerhardware specialist, telecommunicationshardware technical architectmicroprocessor designer and application engineermicrowave systems engineermicrowave transmission systems engineernetwork architect - computer systemsnetwork designer - computer systemsnetwork engineer, communication hardwarenetwork specialist - computer systemsnetwork systems engineernetwork test engineeroptical communications engineeroptical communications hardware engineeroptical systems engineer - telecommunicationsradio systems engineersatellite data transmission engineerspacecraft electronics engineer - hardwarespecialist, telecommunications hardwaresystems designer - hardwaretechnical architect - hardwaretelecommunications engineertelecommunications hardware engineertelecommunications hardware specialisttelecommunications specialist - computer systemstelecommunications systems specialistwireless communications network engineer",10050,0,3.639344262,0.22,158,Natural and applied sciences and related occupations,6,Professional occupations in natural and applied sciences,38.46,42,40,22,54,Reading,Digital Technology,Oral Communication,6,10,7,3,7,4,5,17,10,21,7,19,17,16,9,155,6865,0,30,0,2400,200,0,0,0,0,400,0,0,0,20,0,30,0,2340,200,0,6845,0,60,0,0,155,0,0,400,0
105,2148,"Other professional engineers, n.e.c.                                                                                 ",agricultural engineer ,agronomy engineer ,agroprocessing engineer ,"agricultural engineeragronomy engineeragroprocessing engineerarchitect, navalbioelectrical engineerbiomechanical engineerbiomedical engineerbiomedical engineer - research and developmentbio-resource engineerclinical biomedical engineerdairy plant engineerengineer, agroprocessingengineer, bioelectricalengineer, biomechanicalengineer, biomedicalengineer, food processingengineer, food technologyengineer in agronomyengineering physicistengineering scientistengineer, textilefood processing engineerfood technology engineermarine engineermarine systems engineernaval architectnaval engineershipbuilding engineership construction engineertextile engineer",520,0,4.533333333,0.108,166,Natural and applied sciences and related occupations,6,Professional occupations in natural and applied sciences,46.15,45,42,23,57,Reading,Digital Technology,Oral Communication,7,10,8,3,7,4,5,17,11,22,8,20,17,17,10,15,505,0,0,0,0,0,0,0,0,0,0,0,0,0,0,0,0,0,0,0,0,505,0,0,0,0,15,0,0,0,0
106,2152,Landscape architects,"architect, golf course ","architect, landscape ",golf course architect ,"architect, golf coursearchitect, landscapegolf course architectlandscape architectlandscape planner",530,3,4.272727273,0.045,179,Natural and applied sciences and related occupations,6,Professional occupations in natural and applied sciences,31.97,47,45,30,57,Digital Technology,Writing,Document Use,5,8,6,4,14,4,5,19,13,17,7,22,20,21,14,0,530,0,0,0,0,0,0,0,0,0,0,0,0,0,530,0,0,0,0,0,0,0,0,0,0,0,0,0,0,0,0
107,2153,Urban and land use planners,city planner ,city planner - land use ,community and urban planner ,"city plannercity planner - land usecommunity and urban plannercommunity plannercommunity recreation plannerenvironmental plannerheritage planner - land useheritage work plannerland use plannerland use specialistlong-range planner - land usemass transit services analystmunicipal park plannermunicipal plannerneighbourhood plannerpark plannerpark planner, municipalplannerplanner, community recreationplanner, urban and regionalplanning analyst - land userecreation plannerregional plannersenior planner - land usesite plannertown plannertransportation plannertransportation route planning analysturban and regional plannerurban plannerurban renovation plannerzoning officer - land use",3090,3,4.311111111,0.13,205,Natural and applied sciences and related occupations,6,Professional occupations in natural and applied sciences,37.72,52,53,31,69,Oral Communication,Writing,Digital Technology,14,11,11,3,7,5,8,25,14,21,11,22,16,23,14,390,2180,0,460,0,0,10,0,0,0,0,50,0,20,370,2080,0,460,0,0,10,0,100,0,0,0,0,0,0,0,50,0
108,2154,Land surveyors,cadastral surveyor ,Canada lands surveyor ,city surveyor ,"cadastral surveyorCanada lands surveyorcity surveyorcommissioned land surveyorcountry surveyorland surveying party chiefland surveyorland survey supervisorlegal surveyorparty chief, land surveyingpipeline surveyorport surveyorprofessional land surveyorproperty surveyorprovincial land surveyorrailway surveyorsupervisor, land surveysurveyor, Canada landssurveyor, citysurveyor, countrysurveyor, landsurveyor, pipelinesurveyor, portsurveyor, propertysurveyor, provincial landsurveyor, railway",935,3,2.84,0.38,215,Natural and applied sciences and related occupations,6,Professional occupations in natural and applied sciences,25,53,53,35,74,Document Use,Oral Communication,Oral Communication,3,10,12,3,18,5,2,25,15,25,10,21,29,24,13,0,870,0,55,0,0,10,0,0,0,0,0,0,0,0,0,0,55,0,0,10,0,870,0,0,0,0,0,0,0,0,0
109,2161,"Mathematicians, statisticians and actuaries                                                                          ",actuarial analyst ,actuarial assistant ,actuary ,"actuarial analystactuarial assistantactuaryanalysis supervisor - statisticsapplied mathematicianapplied statisticianassociate actuarybiological and agricultural science statisticianbiometricianbiostatisticianbusiness and economics statisticiancasualty actuarychemistry statisticiancipher expertconsulting actuaryconsulting pension actuarycryptanalystcryptoanalystcryptographerdemographereducation statisticianenvironmental epidemiologistepidemiologist (except physician and veterinarian)financial statisticianindustrial statisticianinsurance actuarylife actuarymathematical statisticianmathematicianmathematician, researchmedical statisticianmethodologist, statisticaloperations research analystoperations researcheropinion polling statisticianphysical science and engineering statisticianpublic health statisticianresearch mathematiciansales statisticiansenior actuarial analystsocial science statisticianstatistical analysis supervisorstatistical analyststatistical consultantstatistical methodologiststatisticiansurvey statisticianvital statistician",3980,3,4.574074074,0.159,218,Natural and applied sciences and related occupations,6,Professional occupations in natural and applied sciences,50,69,42,39,68,Digital Technology,Writing,Reading,18,9,9,3,9,5,11,20,9,22,14,32,19,26,12,355,0,0,195,0,1575,135,0,0,0,50,1670,0,355,0,0,0,195,0,0,135,0,0,0,1575,0,0,0,0,50,1670,0
110,2171,Information systems analysts and consultants,"account manager, IT (information technology) consulting ","analyst, business - computer systems ","analyst, computer ","account manager, IT (information technology) consultinganalyst, business - computer systemsanalyst, computeranalyst, computer simulationsanalyst, computer systemsanalyst, informatics securityanalyst, information systems - computer systemsanalyst, information technology (IT)analyst, management information systems (MIS)analyst, MIS (management information systems)analyst, systemsapplications analyst - computer systemsartificial intelligence analystartificial intelligence consultantauditor, systemsbusiness analyst, computer systemsbusiness analyst, informaticsbusiness continuity analystbusiness re-engineering analyst, systemsbusiness systems analystbusiness systems specialist - computer systemscomputer analystcomputer consultantcomputer simulations analystcomputer systems analystcomputer systems development co-ordinatorconsultant, data processingconsultant, information technology (IT)consultant, management information systems (MIS)consultant, systemscontingency planner, information systemsco-ordinator, computer systems developmentdata processing consultantEDP (electronic data processing) auditorelectronic data processing (EDP) auditorinformatics applications analystinformatics business analystinformatics consultantinformatics quality assurance (QA) analystinformatics security analystinformatics security consultantinformation systems analyst - computer systemsinformation systems business analystinformation systems contingency plannerinformation systems quality assurance analystinformation systems quality assurance (QA) analystinformation technology (IT) analystinformation technology (IT) business analystinformation technology (IT) consultantinteractive media consultantInternet security analystIT (information technology) business analystIT (information technology) consultantIT (information technology) consulting account managermanagement information systems consultantmanagement information systems (MIS) analystMIS (management information systems) analystMIS (management information systems) consultantmultimedia consultantplanner, systems securityQA (quality assurance) analyst - informaticsquality assurance analyst, information systemsquality assurance (QA) auditor, softwaresecurity planner, systemssimulations analyst - computer systemssoftware QA (quality assurance) analystsoftware QA (quality assurance) auditorsoftware quality assurance (QA) analystsystem integration analystsystem integration consultantsystems analystsystems auditorsystems consultantsystems QA (quality assurance) analystsystems quality assurance (QA) analystsystems security analystsystems security plannersystems specialist, business - computer systemssystems specialist - computer systems",61785,3,3.583333333,0.113,158,Natural and applied sciences and related occupations,6,Professional occupations in natural and applied sciences,37.5,44,47,15,52,Digital Technology,Writing,Reading,1,15,6,3,0,5,7,15,11,17,3,26,17,20,12,2190,12595,485,3735,900,26255,3350,530,425,140,445,10735,0,520,110,135,335,3735,900,23775,3350,530,12460,425,2480,70,150,1560,70,445,10735,0
111,2172,Database analysts and data administrators,"administrator, data ","administrator, database ","analyst, database ","administrator, dataadministrator, databaseanalyst, databaseanalyst, EDP (electronic data processing)analyst, electronic data processing (EDP) systemsarchitect, databasedata administratordata analyst - informatics and systemsdatabase administrator (DBA)database analystdatabase analyst (DBA)database architectdatabase architect (DBA)database designerdatabase management supervisor - computer systemsdatabase managerdata custodiandata dictionary administratordata minerdata mining analystdata processing specialistdata warehouse analystDBA (database administrator)DBA (database analyst)DBA (database architect)designer, databaseEDP (electronic data processing) analystEDP (electronic data processing) specialistEDP (electronic data processing) systems analystelectronic data processing (EDP) specialistelectronic data processing (EDP) systems analystinformation resource analystmanager, databasespecialist, electronic data processing (EDP)supervisor, database management - computer systemssystems analyst, EDP (electronic data processing)systems analyst, electronic data processing (EDP)technical architect - database",4115,3,3.773195876,0.03,172,Natural and applied sciences and related occupations,6,Professional occupations in natural and applied sciences,32.97,52,42,23,55,Digital Technology,Reading,Document Use,3,11,10,3,7,2,4,11,6,24,10,27,22,20,12,110,795,0,90,15,2420,245,45,0,0,0,395,0,0,10,0,0,90,15,2195,245,45,795,0,225,0,0,100,0,0,395,0
112,2173,Software engineers and designers,application architect ,artificial intelligence (AI) designer ,artificial intelligence designer ,"application architectartificial intelligence (AI) designerartificial intelligence designercomputer applications engineercomputer software engineercomputer telecommunications software specialistdesign engineer, softwaredesigner, softwareembedded software engineerengineer, softwaresimulation software design engineersoftware architectsoftware design engineersoftware designersoftware design supervisorsoftware design verification engineersoftware engineersoftware systems designersoftware systems integration engineersoftware technical architectsoftware testing engineerspecialist, telecommunications softwaresupervisor, software designsystems applications engineersystems architectsystems designer - softwaresystems engineer - softwaresystems integration engineer - softwaretechnical architect - softwaretelecommunications software engineertelecommunications software specialisttest engineer, softwaretesting engineer, software",16505,0,3.914772727,0.086,168,Natural and applied sciences and related occupations,6,Professional occupations in natural and applied sciences,48.08,45,42,23,57,Reading,Digital Technology,Oral Communication,7,10,8,3,7,4,5,18,11,23,8,21,17,17,10,305,7985,15,180,35,6530,555,45,20,15,40,780,0,45,15,0,15,180,35,5810,555,45,7985,20,720,15,0,245,0,40,780,0
113,2174,Computer programmers and interactive media developers,animation programmer ,application programmer ,business application programmer ,"animation programmerapplication programmerbusiness application programmercomputer application programmercomputer game developercomputer programmerdetail programmerdeveloper, softwaree-business (electronic business) software developere-commerce (electronic commerce) software developerEDP (electronic data processing) applications programmerelectronic business (e-business) software developerelectronic commerce (e-commerce) software developerelectronic data processing (EDP) applications programmergame developer, computergraphical user interface (GUI) designergraphical user interface (GUI) developerinteractive media developerinteractive media programmerJava programmermainframe systems programmerminicomputer systems programmermultimedia developermultimedia programmeroperating systems programmerPC (personal computer) application developerpersonal computer (PC) application developerprogrammer analystprogrammer, animationprogrammer, interactive mediaprogrammer, special effectsprogrammer, systemsprogrammer, Websatellite scientific telecommunications programmerscientific programmersoftware developersoftware developer, e-business (electronic business)software developer, e-commerce (electronic commerce)software developer, electronic business (e-business)software developer, electronic commerce (e-commerce)software development programmersoftware programmerspecial effects programmersystems programmerteleprocessing software programmervisual basic programmerWeb programmer",38550,3,3.706214689,0.048,161,Natural and applied sciences and related occupations,6,Professional occupations in natural and applied sciences,35.9,50,33,16,62,Reading,Digital Technology,Digital Technology,7,11,7,3,5,3,4,13,8,25,4,24,19,24,4,1110,8830,255,1025,1155,21945,1620,210,60,55,100,2185,0,250,10,95,135,1025,1155,20060,1620,210,8735,60,1885,25,120,850,30,100,2185,0
114,2175,Chemical engineers,corporate Webmaster ,e-business (electronic business) Web site developer ,e-business Web site developer ,corporate Webmastere-business (electronic business) Web site developere-business Web site developere-commerce (electronic commerce) Web site developere-commerce Web site developerInternet site designerInternet site developerIntranet site designerIntranet site developerWeb designerWeb developerWeb managerWebmasterWeb site designerWeb site developer,9245,3,3.824546756,0.1135,199,Natural and applied sciences and related occupations,6,Professional occupations in natural and applied sciences,31.71,60,51.5,25,62.5,Digital Technology,Reading,Writing,12,12.5,7,3.5,8.5,3.5,6.5,16,12,23.5,6.5,28.5,19.5,23,16.5,60,630,35,600,1165,2540,195,30,25,0,25,545,0,60,0,25,35,600,1165,2460,195,30,605,25,80,0,0,0,0,25,545,0
115,2211,Chemical plant machine operators,analytical chemistry technician ,analytical chemistry technologist ,"analytical technician, chemical ","analytical chemistry techniciananalytical chemistry technologistanalytical technician, chemicalassistant, laboratory - applied chemistrybiochemistry laboratory technicianbiochemistry laboratory technologistbiochemistry technician (except medical)biochemistry technologistbiochemistry technologist (except medical)brewery technicianbrewery technician - applied chemistrycellulose film solutions testerchemical analysis specialistchemical analystchemical engineering technicianchemical engineering technologistchemical laboratory analystchemical laboratory supervisorchemical laboratory technicianchemical laboratory technologistchemical process analystchemical processing quality control technicianchemical processing quality control technologistchemical process technologistchemical products quality control technologistchemical research technicianchemical research technologistchemical technicianchemical technician - heavy water plant and nuclear generating stationchemical technician, NMR (nuclear magnetic resonance)chemical technician, nuclear magnetic resonance (NMR)chemical technologistcompressed gases testerdocuments examiner - applied chemistrydyeing and finishing techniciandyeing and finishing technologistdyeing technicianfood processing quality control technicianfood processing quality control technologistfood technicianfood technologistforensic examiner - alcoholforensic lab analyst, chemicalforensic laboratory technicianforest products technologistformulation technicianfuel techniciangas chromatographergeochemical techniciangeochemical technologisthandwriting expert, forensichome economics technologistindustrial hygiene technologistinspector, pharmaceuticalslaboratory assistant - applied chemistrylaboratory technician, chemicallaboratory technologist, chemicallaboratory testerlaboratory tester, chemical processinglaboratory tester - pulp and papermass spectrometer technicianmass spectrometer technologistmass spectrometry technicianmaster dyer - textilesNMR (nuclear magnetic resonance) chemical techniciannuclear magnetic resonance (NMR) chemical technicianpaint technicianpetrochemical engineering technicianpetrochemical engineering technologistpetrochemical laboratory technologistpetroleum processing testerpetroleum research technologistpharmaceuticals and toiletries inspectorpharmaceuticals inspectorpilot plant technicianpilot plant technologistplastics and synthetic resins technicianpolymers testerquality control technician - chemical processingquality control technician - chemistryquality control technician - food processingquality control technologist - chemical processingquality control technologist, chemical productsquality control technologist - food processingresearch technologist, petroleumspectroscopic technologistspectroscopistsynthetic textiles techniciantechnician, biochemistry (except medical)technician, chemical engineeringtechnician, chemical processing quality controltechnician, dyeingtechnician, foodtechnician, food processing quality controltechnician, formulationtechnician, mass spectrometertechnician, mass spectrometrytechnician, paintstechnician, petrochemical engineeringtechnician, pilot plant",210,1,3.875,0.76,106,Occupations in manufacturing and utilities,7,Processing and manufacturing machine operators and related production workers,18,29,28,5,44,Document Use,Reading,Reading,4,12,5,3,3,0,2,14,8,15,0,7,18,15,0,2065,1350,0,90,0,0,890,15,25,0,315,60,0,700,375,0,0,90,0,0,890,15,1350,25,0,0,0,990,0,315,60,0
116,2212,Geological and mineral technologists and technicians,"analyst, mines ",assayer ,"assayer, gold ","analyst, minesassayerassayer, goldassayer - mineralogyassayer, precious metalsdiamond drilling techniciandrilling fluid technicianfoundry laboratory techniciangeological engineering techniciangeological engineering technologistgeological prospecting technologistgeological survey techniciangeological techniciangeological technologistgeology technical assistantgeophysical data techniciangeophysical equipment operator, airbornegeophysical observergeophysical prospecting technologistgeophysical survey techniciangeophysical survey technologistgeophysical techniciangeophysical technologistgold assayergold prospectorgravity data techniciangroundwater technologistheat treat technicianhydrographic survey technicianhydrographic survey technologisthydrological technicianhydrology technicianlaboratory technician - metallurgylog analystlog technicianmagnetic observermarine geoscience technologistmetallurgical control analystmetallurgical engineering technicianmetallurgical engineering technologistmetallurgical technologistmine analystmine development technologistmine production technicianmineralogy technicianmineralogy technologistmineral technicianmineral technologistmine survey technicianmine survey technologistmining engineering technicianmining engineering technologistmining survey technicianmining survey technologistmining technicianmining technologistmud man - petroleum drillingmud man/woman - petroleum drillingmud woman - petroleum drillingoil geology technologistore technologistpaleontology technicianpalynology technicianpetroleum engineering technicianpetroleum engineering technologistpetroleum field technologistpetroleum geology technologistpetroleum technicianpetrology technicianphysical metallurgy technicianphysical metallurgy technologistprecious metal assayerprospectorprospector, goldreservoir engineering technicianrock mechanics techniciansea-bottom technologistsea-floor technologistseismic exploration line crew co-ordinatorseismic exploration observerseismic prospecting observerseismic survey co-ordinatorseismic technicianseismology technician - petroleum geologyseismology technologist - petroleum geologyseismometer techniciansoil science technician - miningtechnician, geological engineeringtechnician, geological surveytechnician, geophysical datatechnician, geophysical surveytechnician, gravity datatechnician, hydrologytechnician, logstechnician, metallurgical engineeringtechnician, mine productiontechnician, mineralogytechnician, mine surveytechnician, miningtechnician, mining engineering",465,0,2.133333333,0.91,124,Natural and applied sciences and related occupations,6,Technical occupations related to natural and applied sciences,30,34,31,18,40,Document Use,Reading,Oral Communication,4,9,6,3,7,3,4,13,9,17,4,12,18,10,6,30,370,0,0,0,0,55,0,10,0,0,0,0,0,0,0,0,0,0,0,55,0,370,10,0,0,0,30,0,0,0,0
